user,text,time
@86Yall,The bills don't but I got a steelers game to worry about,1h
@TribDavidson,"Steelers face long odds, but unlikely champions have been crowned before | http://TribLIVE.com",1h
@JBaileyNFL,I’m not nervous about tonight. I’m just hoping that the Steelers give Ben a good sendoff and go balls to the wall.,1h
@Theffsc,Chill don’t Steelers still have mason rudolf?,1h
@Toddskiii00,Send em to the Steelers,1h
@Mr__Raya,"and Steelers eagles and raiders deserves a shot at a Super Bowl run? come on man. Yeah we had some bad games, but LITERALLY every team in the NFL had a couple bad games. That’s the NFL.",1h
@CTC_Tho,Steelers win tonight. Heard it here first.,1h
@chiburghh,#HereWeGo,1h
@NickelCooknLock,Sorry for the hiatus but we’re back. Steelers +12.5 2U Too big of a spread for a playoff game. Steelers feel disrespected.,1h
@dumbidiottt,he can’t even blame it on the filter either cause there’s a gif of juju in a steelers jersey on the pic too,1h
@hollywoood316,Polamalu is it cause it's too cold for the Birthday Suit. #HereWeGo #Steelers,1h
@BBoyle44,"Here we go Steelers here we go!!! Playoff football time! Let’s keep this season going! 7 seed, going for ring 7, for #7 #HereWeGo #SteelerNation #777",1h
@Artlop0007,Picking Steelers in a upset,1h
@UpperCenter_303,GO STEELERS,1h
@GroovyCam,I'm gonna pass on the Steelers/Chiefs,1h
@paulfinnerty87,"Tonight could be the last, so @_BigBen7 you’ve noting to prove and noting to lose so lets rip up the play book and have some fun. One last time #forben #HereWeGo #steelers #thankyouben #steelernation @steelers #nfl @SkySportsNFL",1h
@MDSnizzo74,Not really much different..that’s like pick your poison right there based on stats alone. With CEH out & Williams dinged up hopefully they can stop run and get them in 3rd & long situations. But I think they need to jam Kelce at the line and high low him in coverage…,1h
@WlTHERSPOON,Please be competitive,1h
@dillybar2145,#HereWeGo,1h
@XavierRuedaOro,#HereWeGo,1h
@PenguinNation71,Go steelers,1h
@SteelCurtainRis,"Does the #Houston #Texans firing David Culley spell.... http://bit.ly/3FrMDk2 Another sour apple on the @CowherCBS coaching tree? No, it does not. #HereWeGo #Steelers",1h
@davidrosswelsh,YES SIR,1h
@TrillRonHubbard,The way these games been going… it’s all lining up for the Steelers to have one of the biggest upsets in history…,1h
@roneil2929,"I’m lowkey hoping the Steelers get jimmy g this offseason if they can’t get Rodgers, wilson or Watson!",1h
@2021_tomorrow,トンガへの救援とか援助はしないの？,1h
@cmoneykasper94,Steelers going to get blown out,1h
@Blake120702,27-24 Steelers,1h
@em_t73,I’m nervous about Steelers here..,1h
@Tony_Choppe,ravens fans wishing the steelers would win lord what happened to my team,1h
@Peyton69714093,Let's go Steelers,1h
@EmacDFS,Get ready for Wild Card Sunday single game action with Team by Position Breakdowns and FULL Player Pool Rankings courtesy of @Awesemo_Com @AwesemoNFL @steelers at @Chiefs #SundayNightFootball F-R-E-E,1h
@ramgray,"Skip they’re ready to play, they just not as good as the 49ers! OVERRATED! The Cowboys are probably better than the Steelers, and the Eagles. That’s it for all the 14 teams in the playoffs.",1h
@steelers,Seeing a lot of Black & Gold,1h
@taylooo___,So ima ignore what Big Ben said and enjoy my Steelers tonight,1h
@BrandonHamblin5,35-14 Steelers,1h
@Bad2thebonezz,Let’s see how the Steelers game goes in a few minutes,1h
@BillyDfs1,Looks like a Steelers ML hedge,1h
@EEvans4407,@_BigBen7 Looking forward on that W tonight! #Steelers #wecandothis #HereWeGo,1h
@JosephMoney73,"To get Pickett, the Steelers would have to trade up significantly in the first round. Which means futures 1st rd picks. If we’re talking about 2x 1st rd picks for a QB…that QB is NOT in this draft class. Trade for a veteran if trading",1h
@LylykStephen,He's gonna get barely enough sadly,1h
@DaveStown,Lemme take out a nice steak for the Steelers game,1h
@kathygirl1407,SAN FRAN BEATING DALLAS KEEP IT GOING 49ERS...THEN STEELERS BEAT KANSAS CITY...,1h
@JamesSpeer16,13-10 steelers,1h
@GwizTheBeast30,THIS IS BIG BENS FINAL GAME.. HE WILL END UP RETIRING TONIGHT OR TOMORROW BUT WE ALL KNOW ITS COMING.. ILL GIVE BIG BEN LOTS OF APPRECIATION IN THE NEXT COUPLE DAYS. STEELNATION AND THE CHIEFS WILD CARD GAME KICKOFF TIME SET FOR 8:15PM @steelers vs. @Chiefs,1h
@jwjunker,Chiefs/Steelers will be very good.,1h
@Andre_TheApe,You must HATE chief fans if you rooting for Steelers over them,1h
@camiwami21,I either want the Steelers to win or I want them to get demolished,1h
@KlausMaccus,Of course you're salty..The 21st century Steelers are defined by getting dominated by the Patriots LOL.,1h
@JenfwedB,Heath Miller and a handmade Steelers scarf!,1h
@Blizzjuuheardd,"Now that I’m off tomorrow, if my Steelers lose, im chugging a bottle of henny.",1h
@Pmarketos1,"The steelers Dline would have to create the same amount of pressure the Bucs did in the superbowl. On offence, Najee would have to go for over 100 yards.",1h
@billy_DiIl96,Shock em.,1h
@gladysrocher,Lo unico que me reconforta en este momento es la paliza que le están dando a los #Steelers,1h
@williexxx15,He's shitting himself right now,1h
@koalblackman,That's nice!,1h
@ryanmichael66,I will get a Steelers tattoo if they win the Super Bowl this year.,1h
@PBitter21,And tall got beaten by burrow lol,1h
@SRona_58,Calm before the storm #herewego #steelers,1h
@20idpt,Defense will keep them in it. Steelers need to dominate time of possession by running the middle,1h
@Steelersdepot,JuJu with yinz. #Steelers,1h
@laoctavasports,¡ACEREROS Y JEFES SE ENFRENTAN EN EL ESTADIO PUNTA DE FLECHA POR UN BOLETO A LA RONDA DIVISIONAL! @steelers vs @Chiefs @maximoavance Los Playoffs de la @NFL se escuchan en La Octava Sports 1030 AM /107.3 HD2 http://laoctavasports.com App de Radio Centro,1h
@PickManagement,"In 2 career games against the Steelers, Patrick Mahomes has 9 TD’s without an INT. KC scored a total of 78 points in those games. Mahomes only has 3 INT in the last 9 games & a QBR of at least 67.5 in the past 5. 5 Units Mahomes UN .5 INT -120 @btvbets @PanoPick @DubClub_win",1h
@21heubner,Steelers ML tonight.,1h
@Jimbo23Lee,Pittsburgh Steelers against the World! #HereWeGo,1h
@Smaoka,"I love it, Go @Steelers",1h
@piratesfan23,Not worth 500 million,1h
@sportswhiz688,,1h
@Chargernation22,"At this rate, I wouldn’t make it to the Chiefs and Steelers game",1h
@Msilvaaaaaaa,Vou ver esse Chiefs x Steelers hoje ... #NFLnaESPN,1h
@ajay_bcv,Feels like Niners are in decent shape so far.,1h
@nxhxmxc,Hoy voy con los steelers con mas corazón que estadística,1h
@Maveric23412192,ratio + Steelers beating Bum Chiefs,1h
@TONYMONTG,Sports suicide watch begins in 2 hrs #steelers,1h
@jdabauceee,Deshaun Watson would of had 49ers/Philly or Steelers looking Legit!,1h
@BigJonStud88,Listening to @BarstoolBigCat talk himself into Big Ben putting it on em tonight is gonna make fucking do it. Steelers moneyline it is,1h
@GChupik,Chiefs 45 Steelers 13 @Cabbie @SNBets,1h
@InterSteelers,Super Bowl bound #HereWeGo,1h
@816chiefs94,Goooooo Chiefs it was just 38 to 9,1h
@RichieWalsh,Steelers Nation is out at Arrowhead #HereWeGo,1h
@bArtbow,"To all the stat/record people out there, what’s the record for number of sweeps/multiple wins over an opponent in a season? The Bengals got 6 wins vs the Ravens, Steelers, and Raiders",1h
@70PercentClub,Placed this bet from @dufflebagboy32 : Steelers +13 vs Chiefs -115 Risk 1 unit to win 0.87 units 7:15 p.m. CST,1h
@_shmun,after steelers and chiefs game,1h
@adelphojarquin,Ojalá ganen.,1h
@ChuckFanslau,This is awesome!! Hope to see you soon,1h
@PBitter21,"Carr didn't say that lol he said they were going for the tie in the press conference, the timeout changed the raiders minds.",1h
@ademangone,Pat Freiermuth is getting ready! #Steelers #SteelersNation #PennState,1h
@billsbills83,Record vs other playoff teams: Packers 5-1 Buccaneers 4-1 Cowboys 3-4 Rams 2-5 Cardinals 5-2 49ers 4-3 Eagles 0-6 Titans 4-3 Chiefs 5-3 Bills 2-3 Bengals 4-2 Raiders 3-3 Patriots 2-3 Steelers 2-5 Every team has losses to other playoff teams. Don’t understand his argument,1h
@TmanAmongBoys,Last #SuperWildCard #sunday game is going to be a physical one! Like the #under and lean #Steelers and the points. #Chiefs #Pittsburgh #KansasCity #nfl #bestbets #Picks #football,1h
@kevinwears91,Fangio as a DC would be #1 request for the Steelers,1h
@Mattuisepicgame,Steelers fan = automatic W,1h
@itsalwayscraig,The Steelers would have had to have already signed Jesus Christ off the practice squad.,1h
@NFLtrolling,Mahomes about to get messed up!,1h
@PattiMaguire16,Good Luck Steelers,1h
@sethfrnd,Also it's my late grandfather's birthday today. He was a big Steelers fan and hunter. Today the #Steelers are in the playoffs and we found an antler in a park walking today. Happy birthday grandpa.,1h
@Chairoiluminado,"Lo que si, es que KC va a ganarle a tus Steelers. Ni modo",1h
@thetechtosee,Steelers vs Chiefs live stream: How to watch the NFL playoff game online,1h
@LoganDuarte5,#WPMOYChallenge Heyward,1h
@italiaccampos,"si mis steelers no ganan, me voy a poner a llorar machin",1h
@seandean__,you don’t wanna bet on the Steelers game though,1h
@GwizTheBeast30,ITS GAMEDAY STEELNATION!!!! #7 STEELNATION (9-7-1) HEADS TO KC TO FACE THE #2 CHIEFS (12-5) IN THE AFC WILD CARD ROUND. WE ALL KNOW THIS IS IT FOR BIG BEN.. WE ARENT WINNING.. TOMLIN WILL MAKE SURE OF THAT.. WE ARE ASS.. JUST GO PLAY YOUR HEARTS OUT. @steelers,1h
@see_the_sus,Even I know not to be a Steelers fan!,1h
@southsportsera,Steelers,1h
@CB_8032,"Steelers vs. Chiefs - Game Summary - January 16, 2022 - ESPN - via @ESPN App",1h
@mistah_raymond,Come on @steelers,1h
@rhickey266,There’s not a team that made the playoffs the Steelers could actually beat.,1h
@Asael_arell,Ya quiero ver como sacan a steelers ajajajajajaj,1h
@amackkkkkkkk,The Chiefs finna beat the Steelers ass,1h
@2020Georgee,Yea we got lucky with that win early in the season. Would be a much different game this time.,1h
@titus757,#7 about to carry us from the 7 seed to win the @Steelers their 7th ring? Jackpot.,1h
@SteelersJunkie7,#HereWeGo #7for7 #steelers #bennyboot,1h
@john_draxinger,I love my @steelers ! I was happy enough to get a playoff game…. Now to know this is happening you better believe I’m supporting @TeamJuJu all the way!! #HereWeGo,1h
@C3isenhuth,Life will be great if the cowboys lose and the Steelers upset the chiefs,1h
@nate10154,steelers 21 chiefs 14,1h
@thesteve2016,Chiefs 42 Steelers 27 TPY -727,1h
@InterSteelers,Steelers better,1h
@Armandoestones,HOY VUELA EL AGUILA DE ACERO #HereWeGo STEELERS #HereWeGo,1h
@NitrogenSports,The past meets present and future this Sunday night in the blockbuster AFC Wild Card Game between the Pittsburgh Steelers and the Kansas City Chiefs. #PITvsKC,1h
@1LibbeyCowboy,Got dammit,1h
@statsalt,The @steelers are 16-6-3 ATS in their last 25 games in January while the @Chiefs have gone 6-1 ATS in their last 7 games following a SU win. Which team will keep their trend rolling in this clash of AFC foes? The answer lies inside.,1h
@kurtotti_,Cheifs (-12.5) vs. Steelers Easy peasey. The number isn't high enough.,1h
@Jamesc1659,The steelers had a 1st round grade on him and they said they believe he can be a starting QB in the nfl,1h
@BrooklynCardss,"Chiefs 34 Steelers 17 , 556 yards",1h
@HaskinsIsland3,Roll call!!! Steelers Nation let’s see What jersey everyone is wearing tonight,1h
@OlisahElvis,Chiefs Wil blow out the steelers,1h
@BradenHolecek9,Pringle getting another TD vs the Steelers,1h
@AnthonyTa2u,You know who's winning tonight Todd.,1h
@money_maud,Still got some smoke for the Steelers game,1h
@mattcooper3,nice gold steelers hat,1h
@vshamapant,"Well, let’s start with the 9ers please",1h
@PghSportsFan17,Jackson Mahomes is the reason the reason Chiefs are going to lose. STEELERS OWN THAT LOOOOOOSER! He should be banned from the stadium.,1h
@ChiefsDanny58,Relax love Rashad but he didn't play last game against Steelers,1h
@Woodpig83,Steelers over Bucs 21-17,1h
@InterSteelers,55-0 Steelers,1h
@MixMasterMartin,I don’t really follow football but tonight I’m a Steelers fan! #Steelers,1h
@Steelersdepot,Ben getting loose #Steelers,1h
@dawallabeechamp,@steelers @SteelersUnite My son is ready for his first Steelers playoff game! #HereWeGo,1h
@alexk14dfs,We’d better love Steelers/chiefs showdown that much,1h
@FAZIOGTO67,Impressive Mom!! Go Steelers!,1h
@ZePeque20060669,Diggs was taunting like weak ass refs NFL But bears got robbed for looking @ steelers bench this mofo was in players face @GlassJoeJP Refs are a joke,1h
@_GMAN522_,"Andrew. Don’t tweet until Steelers game is over. Thanks Sincerely, - All Steelers Fans",1h
@jcdcd,LETS GO STEELERS,1h
@Bad2thebonezz,The Steelers game is about to start in a few minutes,1h
@eldacke,Cuanto le quieres poner?,1h
@RanOffOnThePlug,Steelers by a million,1h
@NIKSHERR,"If the Steelers win, I will run outside and jump into the snow at 11:30 PM at night with no coat, hat, or gloves. I will start doing snow angels while crying of happiness. Yes I’ll record it",1h
@DanielSegreti,20-17 Steelers,1h
@theistinthought,"The only AFC team I dislike more than the Steelers are the Chiefs, so I’m rooting with you, friend!",1h
@TonySegreti,26-24 Steelers #HereWeGo,1h
@yinzerchemist,So you’re not dedicated? Lol,1h
@ChiefsDanny58,He didn't play last time against Steelers,1h
@NemoflyMT,"0 Stunden pennen, Steelers gucken, Kasten vernichten, weitergucken, weinen, Freude über Ben Retirement",1h
@peytondavis31,,1h
@spamaramis,Steelers. #HereWeGo,1h
@Therealrello24,"@hulu_support since I updated my app, my live has been skipping and choppy. Please have this fixed before the Steelers game tonight. Thank you",1h
@SLSMAGIC81,Steelers win 24-23,1h
@ay_taybay,No one expected to see the Steelers in the playoffs. Fans hoped. We all want that final run. Everyone is counting Pittsburgh out. That the Chiefs will blow us out of KC. I don’t care about any of that shit. I love this damn team. Pittsburgh against the world. #HereWeGo,1h
@flemdog36,Yeah I’ll be ok with that next week. I’d rather see Steelers get destroyed tonight,1h
@Zach_Klette,I have 100$ on the Chiefs tonight my coworker is convinced Steelers are winning,1h
@Koche003,Come on @steelers let's give #BigBen his Last Ride and get the W tonight #SteelersNation,1h
@gegarciad,27-23 Steelers,1h
@CKLLov3,Here We Go Steelers!!!,1h
@DangerousTaco17,"Bruh it’s the Steelers vs Chiefs, every game has been shit so far anyway",1h
@HinesWardEgo,Ben Roethlisberger didn’t even play in that game that was the Steelers COVID game,1h
@AP_NFL,"Mike Tomlin and Ben Roethlisberger are brutally honest about the Steelers’ chances of advancing past the wild-card round of the playoffs. But the Steelers have won a Super Bowl playing in the wild-card round before, so they know anything can happen.",1h
@THorimya,No 1 wants a career losing record qb who is due a big extension and hasn't gotten any better with his bad habits in 9 seasons.. Steelers aren't even in win a ring now mode,1h
@PBitter21,Lol carr literally said the timeout changed their minds. I'll take players word for it over Twitter dumba*sses,1h
@JayHadaway7,Ask the @Patriots how this went for them when billboards were put up for new england hosting the ray lewis retirement party.,1h
@SixBurgh702,"@afan66 hey Alan, any chance I could get a few words from you on What Big Ben meant to you as a Steelers? Working on a project and live to get a quote from you. Thanks",1h
@Deezer007,@steelers are fucked,1h
@Block_Royal8,Steelers ain’t NEEEEEHHHN.,1h
@ChrisRoberts21,If the Chiefs win the Bengals play the Titans. If the Steelers win the Bengals play the Bills.,1h
@dawgdays11,Uh no.,1h
@Salcido_05,Sucks my dad was never around in my life but still a bitter feeling of losing someone . May the Steelers shock the world and beat the chiefs for you,1h
@AssusReamus,Pittsburgh knocks him out early Steelers 17 Chiefs 14,1h
@krasphases,the steelers r playing tn and my father asks me if im watching as if ive watched a single full football game in the past two years,1h
@Dominos_Fastest,I’m growing more confident the Steelers will win by the hour.,1h
@OzzyMan92,Don’t like the Steelers but IMAGINE Ben whooping Mahomes ass . Yeaaaaaa… no.,1h
@realMcD714,Ben gonna throw the ball a minimum of 50 pass attempts tonight,1h
@KoKo_Kabana,As they should #Steelers,1h
@ZFausnaught,@DavidMTodd How we looking at the tailgate/bar scene DT? Steelers fans gonna make up +/- 25% of the in stadium crowd?,1h
@dusty_stanfill,I’m ready for #Chiefs and #Steelers,1h
@Steelersdepot,Win for Ben!!! #Steelers #HereWeGo,1h
@FritzHrdlicka3,I’ve seen a lot of people today say they think the Steelers are gonna win and I’m not exactly sure why . They got absolutely destroyed the first game and Juju coming off injury all season won’t move it that much,1h
@PeterPeter_,My daughter is a Steelers fan and an idiot,1h
@THE_OhiOGuys,Are you worry about them @Steelers,1h
@selenesolorio,No seas envidioso siii!!!,1h
@Zanesvvv,Internet is gonna break if the Steelers win,1h
@Kevo_Bevo,"Steelers game plan: Feed Najee, 3rd and long throw it at 35",1h
@align_orozco,Out for the game. Concussion.,1h
@sincedahmid70s,They are so ready! God bless.,1h
@daniel_amoia,"There are going to be exactly 46 points scored in the Steelers/Chiefs game. Get ready, @TheyAlreadyKnew …",1h
@tbhardon90,"If the Steelers pull off the upset tonight, I will be erect for longer than 4 hours. Fuck the Chiefs. #NFL #PITvsKC",1h
@Funntastic,I picked them to win too!,1h
@DenimCat96,Ummm why you wearing a Steelers hat?,1h
@Hedubardo,Nunca pensé que iba a esperar un partido de los Steelers como uno de Boca.,1h
@JimKa3ceb,Are you still a Steelers fan?,1h
@truthhurtz85,@BarstoolBigCat @Jerrythekid21 Steelers ml big time! #Steelers #SteelersNation #BigBen,1h
@machemontemayor,A mi tmbn me gusta Steelers +13 y Williams TD,1h
@Black124,"@steelers Its all or nothing today. @steelers can win this game, if they play smart. Use the crowd to your advantage, don’t be over zealous and play with urgency.",1h
@Thehug61385034,Put the money were the mouth is if you think the steelers can beat the chiefs.,1h
@nadiagilkes,I ain’t expect the Steelers to win or nothing but damn … respect Big Ben legacy enough to let his team get a field goal or something. Y’all ain’t gotta send him out like this. #playoffs2022,1h
@kendell_m,#SuperWildCard Weekend continues on Sunday Night Football! Steelers vs. Chiefs - TONIGHT on NBC and Peacock TV.,1h
@Blitz_Burgh,Ben Roethlisberger has arrived! #Steelers #NFL,1h
@ThePyrvmids,I want this to be Ben last game tonight. Free the Steelers.,1h
@JRoc_102,I hope the Steelers wen tho,1h
@clem_simi,I need Steelers to win cos I know the niners gonn win then I’ll finally take this betting shit serious,1h
@RonaldRoden4,thanks to you and @RichieWalsh for this pregame stuff for Steelers Nation,1h
@jessicaaking13,It’s snowing. We’re eating pierogis and getting ready for the Steelers game. 2004 me would not recognize 2022 me.,1h
@mikey_b1977,It’s against the Steelers I wouldn’t be shocked if he throws for 350,1h
@0xAlexL,30 chiefs 17 steelers,1h
@TheKennessy,Steelers bout to get the boot tonight.,1h
@StefonDiggs9,Shitty games go steelers,1h
@bookie_blitz,"The @Chiefs have been better in the first half, posting a 9-8 first-half ATS record, while Pittsburgh has a 6-11 first-half ATS record. And the Chiefs are 4-0 ATS in their last 4 home games. 2022 #NFL #SuperWildCardWeekend Picks: #Steelers vs #Chiefs -https://buff.ly/3Ke1emB",1h
@dgarciar10,:( Quería saber si ves a los Steelers sacando a Kansas City.,1h
@jankykids_co,"""Steelers getting beat physically and emotionally""",1h
@Cody_Elias,Something to be cognizant of heading into Steelers & Chiefs tonight. When Ben Roethlisberger throws for less than 230 yards in the postseason... the Steelers are 10-1. 300 or more yards? 0-6 #HereWeGo,1h
@StowersVernon,Topeka. Ks. Go. Steelers,1h
@SpinGriffey,If the 9ers win.....Eagles & Steelers fans better give thanks for the time slots we got lmao.,1h
@jmotpt,@steelers @SteelersUnite #HereWeGo,1h
@j_steelers,"Damn, that is one nice collection, my dude! Respect to the time and $$$ invested in there.",1h
@Ohiogator19,Talking shit on another teams board. Nice. Tell me again. What was the Steelers score ? Don’t wanna talk about thst huh. Typical trash,1h
@pepemix,Esperando a que Gane #Pittsburgh Steelersy continuar en la #Batalla hacia el Súper #Domingo Ojalá que así sea,1h
@PurpleReignEra,I wouldn’t go that far. I would only root for Steelers this game. Fuck Mahomes. I don’t like rooting for the top QB in football. If Steelers some how win. I hope they get demolished next week,1h
@JBird25WCBC,"Hi guys! Courtis, I’m actually rooting for the Steelers tonight!",1h
@Relyks76,"Anxiety has already kicked in, and kickoff is still 2 hours away. #HereWeGo #Steelers",1h
@giancarlo7540,Steelers I want Cincinnati to get through,1h
@CoachKehres,Chiefs 35 Steelers 14 Passing yards 698,1h
@TKfromTC,#WPMOYChallenge Heyward,1h
@PeckBrandon86,"Bengals or Steelers, don't fucking matter! #titanup",1h
@protovybe,The way I’m tired…I may not make it to this chiefs and Steelers game.,1h
@Daniel72833252,Solo al club América,1h
@ChiefsCore,#Chiefs CB Rashad Fenton is QUESTIONABLE vs the Steelers tonight per @SamMcDowell11,1h
@MambaManley4,Retweeting everything Steelers shit unfollow me,1h
@FIREST4RT3R,Mate!,1h
@Dams97260,Et j'vais raté celui des Steelers même si on va se faire fumer j'espère ils vont faire un match de bonhomme au moins pas se faire tabasser c'est les playoffs,1h
@cutty240,You can’t touch Baby Brady. It’s obvious it wasn’t a big push but Baby Brady doesn’t like it. As Jack Lambert of the Steelers once said PUT A DRESS ON THE QBs,1h
@Hound55,"For example, I can't see a team as bad as this year's Steelers qualifying post-pandemic. But it's made everyone's form inconsistent for the most part. ...made my Pick Em year Hell as well.",1h
@B__Hen,Now I don’t mind the Steelers winning because the titans gonna send him to hell next week,1h
@stevechenevey,My parents both passed in the last year but not before taking their #terribletowel to every continent. Let’s win this for them tonight @steelers #Steelers,1h
@falter_wrosch,einfach bezahlt werden um die Steelers siegen zu sehen,1h
@ArrowheadFirst,"If I'm the Raiders and Carr has any interest in being traded, I call the Steelers. Steelers have the need. While they may not be willing to trade firsts, perhaps LV could get a slew of mid rounders to build with and maybe a Steelers vet they like",1h
@TheYurpman,Chiefs 30 Steelers 20 PY: 614,1h
@JayhBetta,Steelers aren’t winning lil bro we’re facing kanas next week,1h
@guppie2121,Chiefs 24 Steelers 17,1h
@elisaaapuente,Let’s go Steelers,1h
@EppleyDaniel,Chiefs 41 Steelers 17 581 yards,1h
@jamesharrisonst,Tony Romo …. You have to focus… lmao TONY you are the Mike Tomlin of QBs all regular season wins and nothing to show for it (if you see this please shut up about the hand deliveredSB team over a decade ago) #Steelers,1h
@PBitter21,Kinda like how mahomes disappeared in SB vs 44 year old brady? Lol,1h
@Rodney1904,"Man, my while timeline is overlooking the Steelers. I understand why but it makes me nervous……Jacksonville knocked a team out of the playoffs ….it’s the NFL anything can happen",1h
@IvanLebrija,#HereWeGo,1h
@MassMan44,"Cant believe I'm gonna say this.....#GoSteelers . I HATE the Steelers, probably more than I Hate the Niners. 2005 is still toooo fresh in my mind BUT 12.5 points are really hard NOT to take. #TakingtheDogs #NFL #NFLPlayoffs",1h
@ChaseEnCashe,The Steelers playing already???,1h
@vivafloresta,@steelers_fan90,1h
@GeriFingers3,Patrick Rock the Steelers world tonight. # Chief’s Rock!,1h
@coons_bob,My wife said “He must be single.”,1h
@gjoslin,"Pray for me, watching the Cowboys and Steelers game from the living room of a Cowboys fan.",1h
@shadowlord7899,Mine is 23-20 Steelers,1h
@TheSteelersWire,"If you're at Arrowhead, send pics/vids and tag us! #Steelers",1h
@GuyMarascoIV,"I agree. I wouldn’t have a problem with the Steelers drafting him, he could end up being good, but Pitt fans think he’s the second coming of Marino and the fact he’d be replacing a HOF’r in Ben it would be an insane standard. I think he’ll already be gone though.",1h
@FameFBG,Lmaoo steelers game didn’t start yet,1h
@TylerFurlongAK,What if Steelers do win? >.> rioting?,1h
@Mena_ts26,Que ganas de ir a un partidito de los steelers con un jersey de Polamalu que aún necesito regalarme,1h
@snoopydawg44us,You Go Mary! Very Proud of you. Steelers Nations loves you.,1h
@VintageBigBenV2,How hard is it for people to just admit that the Pittsburgh Steelers are going to the Super Bowl?,1h
@LAhenny23,Idk why but these last couple yrs I jus hated them more than the Steelers,1h
@Berges_,A ver qué tal!,1h
@RealJasonSpray,These are outstanding,1h
@PickProfit,Free NFL Player Prop Kansas City Chiefs Vs. Pittsburgh Steelers Zmarc’s Pick: Travis Kelce OVER 5.5 Receptions (-130) #chiefskingdom #kc #chiefs #kcchiefs #kansascity #nfl #football #nflbetting #gamblingtwitter #FreePicks #traviskelce,1h
@MightyCapper,Locking in Steelers / Chiefs in 5 minutes,1h
@josh3302,Steelers by 100,1h
@CameraMan3o5,"Fuck it, i just took the Steelers for tonight Lets go Ben!",1h
@steelpen487,#HereWeGo,1h
@D_SPURR24,TBH if the Steelers score more points than the chiefs they win,1h
@lalinvalenzuela,Eso queee!!! Jajajajaja,1h
