user,text,time
@KahriTheGreat,"With how this wild card weekend is going, I expect the chiefs to put 60 on the Steelers",36m
@jp_santillan,Steelers y TJ Watt se la van a poner difícil a Chiefs te lo juro!,36m
@TKDub,Y’all watch what a well coach teamed looks like. Steelers and Mike Tomlin will make that game tonight interesting.,36m
@mcdonald9409,"#7 for me , won the last two games wearing it so I can’t change up now. Let’s get it done tonight,go Steelers",36m
@pethrusromualdo,Relaxa… eu torço pra Steelers e Giants. Sei que ele não espera muita coisa.,36m
@Colette57476616,Hey GO STEELERS GO CHIEFS may the Best team win,36m
@myslatts,As lonh as its not chiefs or steelers,36m
@NFLBadgers,"The Pittsburgh Steelers have finalized their inactive list for the third and final game of today's Super Wild Card tripleheader. Isaiahh Loudermilk, Joe Schobert, Derek Watt, and T.J. Watt are all ACTIVE. #NFLBadgers x #HereWeGo",36m
@Wh0kev,@steelers let me holla at y’all. They already think we shouldn’t be here in this position. We gotta come ready to get active and be team players. I ain’t gon talk much. But good luck fellas,36m
@RP2872_Jr,Steelers Inactives No. 3 QB Dwayne Haskins No. 15 WR Cody White No. 26 RB Anthony McFarland No. 30 LB Tegray Scales No. 73 DT Carlos Davis @UMTSport @steelers @nfl @SNFonNBC,36m
@PresshubU,How to Watch Pittsburgh #Steelers vs. Kansas City Chiefs Wild Card Game,36m
@SportsbookJazz,What’re you taking tonight? #Steelers +545 #Chiefs -12½ O/U 46½ Bet now → http://jazzsports.ag #PITvsKC #HereWeGo #ChiefsKingdom,36m
@tayfrz,Thought I was watching the @steelers game…it’s a re-run this is why I’m a hockey fan,36m
@ClaudiaUgalde3,Yo soy vaquero x mi papá .. y Steelers por mi marido .. comprenderás que a veces que quiero partir en dos ...jajaja,36m
@si_steelers,The #Steelers inactives vs. Chiefs #HereWeGo,36m
@Chayes_24,I hope the Steelers get the brakes beat off them .,37m
@Ripburger,"So this parlay has gotten pretty spicy. Hedge on Steelers +12? I think not, they are hot garbage!!",37m
@topnotchpicks1,"January 16, 8:15pm (ET) NBC ATS Pick : Chiefs -12 (-109) @pinnacle O/U Pick : Under 46.5 (-106) @pinnacle Steelers vs Chiefs Prediction : Chiefs 28 Steelers 14 #freenflpicks #NFLTWITTER #nfl #GamblingTwitter #topnotchpicks #NFLPICKS #NFLPlayoffs #SteelersvsChiefs #PITvsKC",37m
@steelers5884,"Hard pass on Jimmy G too as next qb.. injury prone, have to scheme for him to be good. Shanahan one of best in NFL, not sure Canada can do it. And he throws some really bad head scratches every game. #steelers",37m
@Isted_1,Great pic! #Steelers #SteelersNation #HereWeGo,37m
@liltorch08stang,Good Luck tonite #7 STEELERS PROUD!!!,37m
@Destinedtofish,Made it to Savannah for the annual STMA conference. Got a quick workout in and it's about time for some Steelers playoff football @DuraEdge #STMA2022,37m
@lakeshoww,Steelers dont got a chance,37m
@snoopydawg44us,Enjoy the Steelers Game Stacy. Let's Go!!,37m
@GBake98,Might as well start the Steelers and Kansas City game Cowboys look done,37m
@cru02715421,"Do the steelers have a fullback?? 6 plays a game, and earns 4 million. Thanks brother TJ!!",37m
@nino22,Packers vs 49ers Tampa vs Rams/Cardinals Titans vs Bengals Chiefs vs Bills (or) Titans vs Steelers Bills vs Bengals,37m
@Flxmingoz,They are the people I root for everything bad to happen and that’s the Steelers. I will never compliment them or wish for anything good,37m
@sarachotv,@maggiesaracho Bday Girl muchas felicidades y éxito a los #Steelers,37m
@patycake15,"Dad was a Steelers fan, mom Cowboys in SB X. I think I cheered Dallas because they had cooler unis.",37m
@Bradypannhoff,I need to know who do you have as first TD scorer for chiefs Steelers game ?,37m
@JBigsHD,"So you’re telling me the Eagles, Cowboys and Steelers can all be eliminated in the same day? That’s a holiday",37m
@cornishyinzer,You wanna see an embarrassment? Steelers gotcha! Coming right up!,37m
@TP3bets,"Not betting it, but my pick for the Steelers/Kc game: Steelers +12.5 Best of luck how ever you play it",37m
@joa0soares,"muito provavelmente o steelers irá perder, mas espero que seja competitivo e quem sabe acontece alguma coisa né…",37m
@CollianoNomad,Hopefully the Steelers and Chiefs game is good because these games so far today have been blowouts,37m
@TEEBS_Podcast,Game 5 Steelers +13 (-112) #NFLPicks #Steelers,37m
@JimShearer,Cat autographs RULE!!!,37m
@drewsmith824,Except the Steelers are going to the Super Bowl,37m
@ArrowheadAddict,Rashad Fenton will not play tonight. Neither will Josh Gordon. Inactives are slowly leaking and we’ve got them all here for #Chiefs and #Steelers,37m
@DavidMTodd,Next year’s #Steelers QB might be playing right now. #JimmyG,38m
@Hilljr42,Steelers or bronco will sell the farm for him though,38m
@Lynch3Conor,Steelers #HereWeGo,38m
@boliver36,Waiting for my Steelers to play by just listening to music and looking at this Cowboys/49ers game.,38m
@LeGervese,Let’s gooooooo! We need this win tonight!! #Steelers #SteelersNation #StillerGang,38m
@412champs,"Imo, Steelers need AT LEAST 25 points to have a shot, offense needs at least 10 in the first half When has that happened last lol",38m
@_simaview,,38m
@ShawnLarson23,Ready for Chief's Steelers game already. Both games today have been lopsided,38m
@USARGDC,Odio a los cowboys. Amargos. Encima nos tienen de hijo a mis queridos redskins. Voy por Steelers a la noche,38m
@ArrowheadAddict,Rashad Fenton will not play tonight. Neither will Josh Gordon. Inactives are slowly leaking and we’ve got them all here for #Chiefs and #Steelers,38m
@steelersfan1398,"Haven’t worn since his retirement, breaking it out for 38-14 Steelers roll tonight.",38m
@KCSportsNetwork,"Get ready for kick, thanks to @ticketsforless @Chiefs vs. @steelers ’ Cover 3 What is Big Ben doing?! KC needs to contain Pat Freiermuth",38m
@DomPi_223,"Day 6 of 21 of RE creating a positive attitude. Has been great, its been a testament of the last 5 days, its getting easier as the days go by....the cherry on top will be the Steelers win today. Great, laughs, great talk, great jokes, great sarcasm, great football..!",38m
@thecharlieo,Don’t forget this king,38m
@joereedy,"And considering how the first Chiefs-Steelers matchup went, there isn't much hope things will turn around. But this game is good news for the Rams.",38m
@FdawgSoCal,If you wanna buy squares to a game it should be Steelers and chiefs,38m
@hills_have_pies,wink if you’re rooting for the Steelers tonight,38m
@DCoda1,Steelers +13 and the underrrrr,38m
@JerryRi48538354,17-14 Steelers,38m
@Jamo1x,"lol acting like we didn’t beat the Steelers 36-10 without Kelce and Tyreek with 2 catches, and our defense gotten better. Chiefs Packers super bowl",38m
@steelers_realm,Steelers take the 2022 Todd Haley bowl in an upset #HereWeGo #NFL,38m
@Fpcharger2,There arent two more arrogant fan bases on our area than Cowboys/Steelers. To see both of them get waxed in week 1 of playoffs is about the best thing that could happen when my team is home watching,38m
@Porfi_trouble,"Si hoy no ganan mis steelers, chinguen a su madre todos",39m
@MoneyBaggJu,Idgaf I would say the chiefs gone lose tonight too but the Steelers ass this year too FUCK YO LIFE BITCH BING BONG,39m
@KazworldTv,Let him air it out!,39m
@WHC_MSwordsman,"At this rate, I just want to watch the Chiefs destroy the Steelers right now. #DallasCowboys",39m
@BigGuyinGA,Go tell the Rooney's one of driving forces Behind playoffs expansion. Their Steelers still have yet to play KC so may want hold that until we have results from that one.,39m
@diegoremirez91,Y si no es el último. #HereWeGo @steelers @acereros .,39m
@jrolgin,"No, please wear a Steelers cap tonight",39m
@AngieBaker37,We're ready in Michigan!!!,39m
@hills_have_pies,wink if you’re rooting for the Steelers tonight,39m
@Jamo1x,"lol acting like we didn’t beat the Steelers 36-10 without Kelce and Tyreek with 2 catches, and our defense gotten better. Chiefs Packers super bowl",39m
@steelers_realm,Steelers take the 2022 Todd Haley bowl in an upset #HereWeGo #NFL,39m
@Fpcharger2,There arent two more arrogant fan bases on our area than Cowboys/Steelers. To see both of them get waxed in week 1 of playoffs is about the best thing that could happen when my team is home watching,39m
@JerryRi48538354,17-14 Steelers,39m
@SteelYoHeart1,Heeeeyyyyy!!,39m
@otcsamurai,Steelers/Chiefs over 45.5 (2) Tailing @ProfitVIPs,39m
@C_Stanfield7,Lmao Steelers Lose By +10,39m
@ycaferreira,Deus abençoe o Pittsburgh Steelers em busca do milagre,39m
@wasabi_tsunami1,"Steelers next too, Sit tight!!",39m
@yaleeeeeexisx3,"Yeah their playing good, but girllllllll I’m actually the KC fan and he’s going for the Steelers so if we lose he won’t shut up about how we lost!",39m
@HudnallBeverly,Go Steelers!,39m
@HitmanSab,@steelers make the room,39m
@ItsDavidsTweet,"*If* the Steelers win, someone please check on me. Thanks. #HereWeGo",39m
@AndyVolz,Here we go Steelers!,39m
@Giovann21972581,Today game of NFL football games it is Kansas City Chiefs vs Pittsburgh Steelers today time is 7:15 steelers going to Kansas City Chiefs home is actually Kansas City Chiefs away who are coming their stadium is Kansas City Chiefs stadium against Pittsburgh Steelers.,39m
@ShiestyKob,Steelers got to play like they got nothing to lose.. go for it on all 4th downs all that,39m
@najee22szn,Ratio,39m
@luisarizmendi89,"@sergiozs1009 aún te quedan: Bengals, Bulls, Buccaneers, SF, Steelers (con retiro soñado del Big Ben), Arizona, Packers y Titans...",39m
@Ross_Gasmer12,I feel like this whole weekend is now setting up for a Steelers win,39m
@tony_calderon94,Por el milagro @steelers #HereWeGo,39m
@46Yinzer,Is that Peter North?,39m
@CelticKim1,Yes!!!!,39m
@volpetom7,Nope I’ll be watching chiefs/Steelers,39m
@Giovann21972581,Today game of NFL football games it is Kansas City Chiefs vs Pittsburgh Steelers today time is 7:15 steelers going to Kansas City Chiefs home is actually Kansas City Chiefs away who are coming their stadium is Kansas City Chiefs stadium against Pittsburgh Steelers.,40m
@ShiestyKob,Steelers got to play like they got nothing to lose.. go for it on all 4th downs all that,40m
@najee22szn,Ratio,40m
@luisarizmendi89,"@sergiozs1009 aún te quedan: Bengals, Bulls, Buccaneers, SF, Steelers (con retiro soñado del Big Ben), Arizona, Packers y Titans...",40m
@Ross_Gasmer12,I feel like this whole weekend is now setting up for a Steelers win,40m
@tony_calderon94,Por el milagro @steelers #HereWeGo,40m
@46Yinzer,Is that Peter North?,40m
@CelticKim1,Yes!!!!,40m
@volpetom7,Nope I’ll be watching chiefs/Steelers,40m
@ChiefsCore,#Chiefs RB Darrel Williams is ACTIVE for tonight’s game against the Steelers and will start,40m
@GolfnDegen,chiefs 36 steelers 18,40m
@gk1194,DO IT! even the steelers hated him,40m
@dwhTowson,Especially the STEELERS. jeez!,40m
@snstewart63,This came for my brother Jim in the past a few months ago diehard Chiefs fan he was !!! we going to wip the Steelers ass again Jimbo,40m
@theonlyrealtb12,I don’t even mind the players talking but when fans do it it’s ridiculous. Especially since 99.9% of them never stepped foot on a field,40m
@MassMan44,"If the @steelers pull of the upset, itll be a GOOD DAY!",40m
@STLRSuperFanDad,Cody White inactive for the Steelers in the Wild Card game against the Chiefs,40m
@Army27402512,Creen que gane los Steelers el momio +500 osea que probabilidad hay d porcentaje q ganen?,40m
@StUpIdItYStUdIo,THE STEELERS ARE GOIN TO DA FUGGIN SUPERBWOL!!!!!!!,40m
@Pablik21,Como ves al rato con Najee Harris Steelers?,40m
@NEBEsrq,#WPMOYChallenge Heyward,40m
@RuuunRuun,Chinga tu madre que si pasaron los bucaneros ni modo toca que Steelers les gane en el super bowl,40m
@adoswarrior19,Steelers,40m
@kidmammoth,,40m
@LeeCEldridge,Steelers are only mediocre on a good day.,40m
@swaveman01,Just can’t wait to tweet Steelers down bad all night,40m
@Jbrown_412,THE STEELERS,40m
@shodmock,Steelers next up,40m
@chucky504,Nah Steelers,40m
@NRichardson02,What’s wrong with being a Steelers fan,40m
@Lookintomylens,#HereWeGo,40m
@Jmo_Picks,"Here’s another 1 unit teaser for everybody 7 points -130 Steelers +20 Rams +3.5 Also adding Steelers +14 -130(1u) Steelers ml +550(.5u) Lots of action this weekend, BoL",41m
@yuricrfx_,⠀tudo (falta o @ do steelers na bio,41m
@HaZaBig_Johnson,Hoping that the Steelers actually put up a fight tonight,41m
@BarnesAngNoble,Steelers don’t let me down I’m tryna rebuild the roster tn,41m
@FrankbyXmas,4/4 Chiefs and Steelers next,41m
@nolacakedealer,Next football season I will go to a @steelers game #Manifest,41m
@bridamvp,I hope the Chiefs blowout the Steelers just like these other games,41m
@bamafox1,#HereWeGo,41m
@PurpleEggsNHam,I'm soaking up all the warm happy Cowboy loss feels now while I can. My Steelers are gonna get stomped tonight.,41m
@Smokey_ua8,We gonna be taking more shit bout y’all bum ass Steelers in a few hours just wait,41m
@Gray1_9_9_8,Chiefs 33 : Steelers 19,41m
@morelfinder,Steelers win in OT with kickoff return. Bet it.,41m
@bobm806,"Bradshaw was very good, deservedly a HOFer. There's too many Steelers in Canton, but Bradshaw belongs",41m
@jhfenton,So she had no choice. I can respect that. I just can't abide Steelers fans in Cincinnati. They clearly have no soul.,41m
@DylanMSanderson,Steelers winning tonight btw,41m
@mtahmisian24,Call me a little superstitious but we've never won when I'm wearing my jersey so I'm not lol. Wearing Steelers colors and a Steelers sweatshirt.,41m
@Perrocool40E,Vamos #Steelers ... vamos BigBen ¡¡¡ todo sea por ver caer al niñito mimado de Mahomes,41m
@Rico_Ray420,A shot per point total if the Steelers beat the chiefs !!!,41m
@wangmi__,Need Steelers and under free roll for 3 eth pls,41m
@pptafag2,"Tem q entender q camisa pesa, mahomes vai tomar 9 sacks e que o big ben vai levar esses steelers pra final de conferencia na base da fé",41m
@Jcob_Ezekiel,Gonna be watching Chiefs vs Steelers in the office,41m
@mos43,Drinks of choice tonight? #Steelers,41m
@jepezzz,"Ainda bem que varios times estão apanhando, ai o Steelers apanhar vai ser só mais um",41m
@alaninvegas,#Steelers #SteelersNation Y’all rooted for the #raiders last week. Allow us too root for your team this week! #FtheChiefs Go Steelers! One more win for #BigBen!,41m
@Coach_Steve72,"I know the Steelers probably won’t win, but because of @getnickwright I’m. Steelers fan tonight.",41m
@Steelersdepot,Steelers inactives Wild Card Round vs. Chiefs https://steelers.com/news/steelers-inactives-wild-card-round-vs-chiefs?utm_source=dlvr.it&utm_medium=twitter… #Steelers,41m
@MattLight,Steelers W confirmed,41m
@_Almightyj__,@steelers,42m
@Jxyyy16,ratio,42m
@TMotri,Let’s go Steelers!! #SteelersNation,42m
@ThatDudeKG16,Honestly the Steelers need to hold up offensively tonight. Defense will do their thing if they can stay off the field,42m
@bepryor,"With JuJu Smith-Schuster back, WR Cody White goes to the inactives. Rest of Steelers inactives tonight: QB Dwayne Haskins, RB Anthony McFarland, LB Tegray Scales, DT Carlos Davis",42m
@GolfnDegen,steelers 18 chiefs 16,42m
@mabrown0,Who got Steelers tonight !? i got the chief,42m
@charles4_king,This irrational confidence I have in the Steelers tonight is going to be my downfall. isn’t it…,42m
@scottdr1993,It’s playoff time. This is where the Steelers thrive,42m
@jotunthrash666,Pats out Dallas on their way just need the Steelers gone and it’s perrrrrfick.,42m
@tayzthecreator,Steelers getting closer and my boxers are getting wetter,42m
@Rafaelpoa,Belo jogo da base antes dos @steelers,42m
@KJovenitti,should get a holster for Steelers games,42m
@TradCathKing,At least I don’t have to care about the playoffs anymore. Both my teams are out. I’m gonna root for chaos. LETS GO STEELERS!,42m
@RetiredArmySF,I think we shold be watching the game together. Lol go steelers,42m
@BoogieSZN0,You telling me the chiefs and Steelers bout to the game of the night?,42m
@Deadpoolmx2,"Ya con esto cambio canal mejor veo a #Steelers Que pinche vergüenza ver estás cagadas y viendo que no ha llegado @Chivas una sola vez a portería a Pachuca , significa no ganaremos @mmichelleano solo va a poder con equipitos mediocres está temporada al parecer",42m
@GuyroWasTaken,If the Steelers somehow pull it off tonight SAS is going to have a field day,42m
@LanceTHESPOKEN,"Snow is expected to be in KC before and during the game. The Steelers can’t run the ball in 70 degree weather with clear skies, in case anyone was thinking this gave them any advantage OH and then there’s this guy.",42m
@TheSmokingYeti,If the Steelers upset the chiefs…I will go to bed lmao.,42m
@HoytMohr2,Ratio,42m
@TrillEG_,NFL putting the Steelers for SNF for potentially Ben’s last game is total chess . Either you got the end of an era for Ben OR you watch as the “team that’s not suppose be here” shocks the world,42m
@SteelYoHeart1,The stadium is cool. Getting out and climbing that hill is NOT! It's enough for me never to return again.,42m
@booradley42069,It’s a +1440 Steelers ML and under parlay kind of night,42m
@LocksWithDB,who scoring first in the chiefs/steelers game @BookitWithTrent,43m
@JsmallSAINTS,If the #Steelers win tonight I’ll buy whoever likes this tweet a PS5 #NFLWildCard,43m
@DaviOL_7,Sou Steelers. Seja Steelers tbm ADM,43m
@RickCramerCT,@steelers I like our chances. We got our mojo going. And our Ju Ju Back #jujumojosteelers,43m
@MainframeNfl,For @grpwins 1/16/22 Steelers +13.0 3U Caesars / Southpoint,43m
@LanceTHESPOKEN,"Snow is expected to be in KC before and during the game. The Steelers can’t run the ball in 70 degree weather with clear skies, in case anyone was thinking this gave them any advantage OH and then there’s this guy.",43m
@TheSmokingYeti,If the Steelers upset the chiefs…I will go to bed lmao.,43m
@HoytMohr2,Ratio,43m
@TrillEG_,NFL putting the Steelers for SNF for potentially Ben’s last game is total chess . Either you got the end of an era for Ben OR you watch as the “team that’s not suppose be here” shocks the world,43m
@SteelYoHeart1,The stadium is cool. Getting out and climbing that hill is NOT! It's enough for me never to return again.,43m
@booradley42069,It’s a +1440 Steelers ML and under parlay kind of night,43m
@MikeMurray51,My 49’ers and the 3-1/2pts are looking kinda inviting right about now… Are you taking the Steelers and the 13-1/2 points or going with KC?,43m
@HoytMohr2,Bandwagon,43m
@FatboyTweenk,Steelers by 3 #HereWeGo #Steelers,43m
@luisbecerrilr,"Jajaja eso sí. Pero bueno todos tienen chance el día de hoy. #Steelers sale sin presión, no pierden nada y eso los hace jugar mejor. De hecho creo que tienen mucha oportunidad de ganar",43m
@LeeCEldridge,I’ve got Chiefs 34 - Steelers 16,43m
@losluchabros,#HereWeGo #HereWeGo #HereWeGo #HereWeGo #HereWeGo Lucha Steelers Lucha,43m
@RandallSlifer,We’re all rooting for the Steelers so maybe it’s a 2 loss ticket,43m
@GoldenCalebT,"We got our JuJu back, son!",43m
@bluELVTD,"maybe we will get one decent playoff game today, not counting on the chiefs/steelers tho",43m
@DBAkron,"They did not beat anyone who made the Playoffs. Yes, if you just beat the teams that are weaker than you, you can make the Playoffs. Steelers beat both the Bills & Titans, lost by a Touchdown to GB & the Raiders, but blown out by KC & Bengals(2x). Game will be interesting.",43m
@ronvinke,Vergeet de Steelers niet. Dat zij erbij zitten is echt onvoorstelbaar.,44m
@SteeIerNation,HERE WE GO STEELERS...HERE WE GO!! HERE WE GO STEELERS...HERE WE GO!! HERE WE GO STEELERS...HERE WE GO!! HERE WE GO STEELERS...HERE WE GO!! HERE WE GO STEELERS...HERE WE GO!! HERE WE GO STEELERS...HERE WE GO!! #HereWeGo,44m
@eddickson25,First the Cowboys. Next the Steelers. Then the playoffs start!,44m
@2MinsForHockey,"AFC: Titans (4), Chiefs (6), Bills (2), Bengals (4), Raiders (3), Patriots (2), Steelers (2) NFC: Packers (5), Bucs (4), Cowboys (3), Rams (2), Cardinals (5), 49ers (4), Eagles (0)",44m
@newyorkpIswin,we gotta rely on the chiefs and steelers to be the only competitive game today,44m
@WlTHERSPOON,Swept two years in a row,44m
@PDIGGY22,They are going to need about 21 points gifted to beat us imo. Hopefully Steelers rough them up.,44m
@Colette57476616,I don’t know if the Steelers or Chiefs are going to win but I know may the BEST TEAM WIN,44m
@Not4LongMedia,Who will win tonights AFC matchup? Kickoff is at 8:15pm in KC! #Chiefs #Steelers,44m
@aeniarrol,"Ayeeeee this game is over! Now if the Steelers win tonight, it will be a great Sunday",44m
@amazingfilms247,"Betting on Bills vs. Bengals AT Buffalo in 1/16/22 so we can make that #lynching video. Steelers on the #money line, a #will bet, #investment not gambling #military #buffalo #nazi #polizen #state",44m
@losluchabros,#HereWeGo #HereWeGo #HereWeGo #HereWeGo #HereWeGo Lucha Steelers Lucha,44m
@RandallSlifer,We’re all rooting for the Steelers so maybe it’s a 2 loss ticket,44m
@GoldenCalebT,"We got our JuJu back, son!",44m
@bluELVTD,"maybe we will get one decent playoff game today, not counting on the chiefs/steelers tho",44m
@DBAkron,"They did not beat anyone who made the Playoffs. Yes, if you just beat the teams that are weaker than you, you can make the Playoffs. Steelers beat both the Bills & Titans, lost by a Touchdown to GB & the Raiders, but blown out by KC & Bengals(2x). Game will be interesting.",44m
@goochberger1,Great fishing in Quebec,44m
@nickrice_,watch out for them steelers tn they gonna give y’all a game tn,44m
@DaveyyDizzle,Fat L coming for the Steelers,44m
@TCovCards11,"If the 49ers drive 91 yards and put up 7 points here, we can officially start the Chiefs-Steelers game.",44m
@dpenney,@PatrickMahomes would have to get injured on the first play of the game and not return. @steelers have absolutely zero chance,44m
@AngieBaker37,Let's Go Steelers! #blacknyellow #HereWeGo #SteelersNation #steelcurtain #Steelers,44m
@Yung_TrizzleMan,I cant disappear when there is hating to be done…ravens been ass and aint make it…pats bumasses is out…cowboys being ass like they do…now all i need is the steelers to get blown out and im a semi happy man…also fuck yall,44m
@DonSchenck,"Steelers win tonight I’ll post a video of me doing one-arm pushups, on rep for each point of the margin of victory. I’m 62 years old.",44m
@imdyinoverhere,@_BigBen7 make tonight like the country song. you're not as good as you once was just be good once as you ever was! Just say fuk it and chuck it!!! 7th seed number 7 all the way to the 7th super bowl. #steelers,44m
@Mr_Teeeezy,Chiefs up next!! They about to blow the Steelers away,44m
@Danimaldoodoos,I will be rooting for the Steelers brother,44m
@ketchup_bottle,Steelers about to make it a close game,44m
@LordTyrel_AYR,I only want the Steelers to win cuz that little light skin boy needs to humble himself.,44m
@SavannahRG513,I hope the Steelers get their ass cheeks CLAPPED,45m
@kurako20,Cowboysってファンベースでいうと全米レベルですごいんだけど、Billsとかあとそうねぇ、Steelersみたいなファンベースかっていうとそうでもないんだよね。薄く広いみたいな感じで、数はすごいんだけど、圧が弱い。,45m
@steelersfrance,Les inactifs pour les Steelers. JuJu Smith-Schuster est bel et bien ACTIF,45m
@braxtuhn,Short stream but I gotta rep my @steelers babyyy!! PLAYOFF TIME!! TURN ME UP @_TJWatt,45m
@rgomez68,,45m
@JamesMo14763316,Well as a bengals fan I hope the Steelers find. A Way to knock off the chiefs,45m
@Yung_TrizzleMan,I cant disappear when there is hating to be done…ravens been ass and aint make it…pats bumasses is out…cowboys being ass like they do…now all i need is the steelers to get blown out and im a semi happy man…also fuck yall,45m
@DonSchenck,"Steelers win tonight I’ll post a video of me doing one-arm pushups, on rep for each point of the margin of victory. I’m 62 years old.",45m
@imdyinoverhere,@_BigBen7 make tonight like the country song. you're not as good as you once was just be good once as you ever was! Just say fuk it and chuck it!!! 7th seed number 7 all the way to the 7th super bowl. #steelers,45m
@Mr_Teeeezy,Chiefs up next!! They about to blow the Steelers away,45m
@Danimaldoodoos,I will be rooting for the Steelers brother,45m
@ketchup_bottle,Steelers about to make it a close game,45m
@LordTyrel_AYR,I only want the Steelers to win cuz that little light skin boy needs to humble himself.,45m
@Matte_Patte87,"Pushing 12, he's been around",45m
@NickStreetFNC,At least the Steelers won’t be the only team that looks completely outmatched this weekend,45m
@chazJon42844502,Good keep posting and Jackson needs to go make tik toks so y’all will throw pat off his groove like y’all do and Steelers will get the win,45m
@BidenForSix,It’s ok we still have hope for Steelers Chiefs,45m
@Kevin42819304,And the steelers are gonna get blown out tonight,45m
@okstate_takes,"Let downs to the Steelers, Jaguars, blown out by the colts, bullied by the Patriots, came up short to the Bucs and titans..what is historic about that??",45m
@mdonop,Jimmy G to the Steelers next year,45m
@Hunter6622,SnowBEN in the ATL #HereWeGo @steelers,45m
@LittleErnie13,Here we go Steelers!! Come on @ChaseClaypool I know that you can do it!!,45m
@AmandaLeighPGH,Lol this is gonna be well interesting tonight lol,45m
@Venom929,What Shit are they talking ?,45m
@MrPearlHarbor76,Steelers #19 Is Back,45m
@MahomesGoatSZN,,45m
@GunnerParsons,I just hope the Steelers put up a fight with how shit these other games have been.,45m
