user,text,time
@YourDaley_Dose,Steelers need to win because I hate kc.,2h
@BigT54,Anyone other than everyone,2h
@JAY_QUINTANA10,Lowkey heard he’s playing a light skin who gets no ass…. Hammer the Steelers tonight,2h
@ByJoshCarney,"#Steelers have to start fast tonight defensively. Doing so could be key to beating #Chiefs KC’s offense in Q1: -most points in the league -convert third downs at 66% clip -scored opening possession TD in 5 of last 7 games, 9 TDs on opening possessions in total #HereWeGo",2h
@4KTGav,Reports are saying Steelers going to draft a QB,2h
@SebasSabar,"La verdad siento que ando bravo en los juegos de Wild Card. Pero, el de Steelers vs Chiefs me esta costando",2h
@cbrucemiller,24-21 Steelers,2h
@gretschjones,Bills can beat Steelers. Raiders beat Steelers.,2h
@Sika_ah7,Jajajajaja ánimo amigos steelers #HereWeGo,2h
@Kyl_idk,Yo Ben got a dump truck,2h
@Gilanyi,Chiefs - 24 Steelers -7,2h
@ShayneCarnahan,"#Steelers: Roethlisberger: 41-51, 499 yds, 4 TD, 1 INT Harris: 35 rushes, 176 yds, 2 TD, 2 FUM Freiermuth: 13 catches, 145 yds, 1 TD Johnson: 11 catches, 132 yds, 1 TD Claypool: 9 catches, 128 yds, 1 TD",2h
@412Stubbs,His options: 1.Steelers 2. Retire,2h
@ShayneCarnahan,Ran a #Madden22 sim for tonight’s #ChiefsKingdom vs #HereWeGo? Final: @Chiefs 52 - @Steelers 47. You ready for some insane stat lines:,2h
@manuelgarciagg,"No, los steelers seran los unicos underdogs que ganaran, confio en esa defensa.",2h
@Maxproductio,Beat the Steelers and I’ll root for y’all in the divisional round,2h
@KayP5_,Steelers vs chiefs let’s talk bets I like Patrick!,2h
@Johnny_Chimp0,"It's not blind optimism really, I've been a Steelers fan all my life, seen them win alot of games they shouldn't have, ( also seen em shit the bed alot too) I'm expecting a loss, but it wouldn't shock me if they served up a upset at Arrowhead",2h
@kappinkyle,Better off putting it on @steelers MoneyLine +550,2h
@JustThrifting,Steelers by 10 tonight,2h
@pghTRAV,Gonna pass the time before Steelers kickoff by going on every single Facebook community group I’m a member of and repetitively posting “how are the roads”,2h
@dixonstarz,#work2Bdone,2h
@raul_montielc,Acereros Steelers,2h
@RealCalebW,You can find me cheering on my Steelers tonight! Let’s get it! #HereWeGo,2h
@KevinKoelzer1,Patty's unbelievable community America commercial will come true tonight as the @steelers unbelievably beat the @Chiefs,2h
@CardanoKyle1,"I absolutely cannot watch a random (non Steelers or Herbert) NFL game, but I can 100% watch a random (non Ducks) game. I think that speaks volumes about (to me) how much better college football is than the NFL. Again, that’s just me and I can understand not everyone agreeing.",2h
@AltitudeTV,Do we think the Steelers will find a way to score? @natelundy and @toddromerotv aren't so sure. @betmgm,2h
@abenzishere,@_AMISYD_ You forward my call. Haha your funny just like your @steelers .,2h
@PatriotWoman04,@Lays I want to win a bag of #LaysGoldenGrounds from the #Steelers because The Steelers has been my team since I was a little girl and always will be #Sweepstakes,2h
@BangLikeCHOP123,Steelers Play Tonight,2h
@MaskedNinja76,How are we getting that Cowboys/Steelers Super Bowl? lol,2h
@Joury330,Russell Wilson to the Steelers 2022.,2h
jackfraser63@gmail.com,Here's to tonight's game Steelers Nation reaches north of the border,2h
@steveVogt84,This Dallas San Fran game is so boring. Bring on the steelers,2h
@tgreenie22,"But hey yes have a good night, all in good fun. Go Steelers, fuck the Chiefs",2h
@LisaPompeani,Bring us a W Erin,2h
@SThompsonArt23,Feels like the extra wild card team is a bad idea. Two pretty lousy games so far & we haven’t gotten to the Chiefs/Steelers yet,2h
@robmiller268,It's amazing how many people think they need to blitz him,2h
@kingtreeee,pizza or outback for this Steelers game,2h
@Burgh4124,I’ll jump with ya,2h
@ai_curio_bot,steelers vs chiefs,2h
@kids_dad,Triple sevens?? 777? @steelers #HereWeGo Ben. Seed. Ring . FAte @ZHorwat @Tombote123 @KimJFlanders @rudyglove27 @SteelCityGoon84,2h
@BowerHF,Calling the upset right now ! Steelers by 10 ! #HereWeGo,2h
@ricardocarvajal,De aquí hasta Los Angeles si o si #HereWeGo #SteelersNation @steelers @acereros @LynPerez79 @ElizLolaa,2h
@SidekicksPicks,"I mean… im down, but only if Steelers to punt on 1st drive is on the ticket",2h
@DabmanNft,Steelers :),2h
@LNemesis19,Shut your yap Stephen. I see you are feeling better. Glad to see that. Your Steelers are gonna get beat punished tonight.,2h
@seeingclearlya1,I'm not supersitious at all....I'm only wearing the same unwashed recently resurrected 'business is boomin' sweatshirt that I've worn the last 2 weeks...#steelers,2h
@Tam_Resist,"I’m not rooting for the Steelers, so that helps, right?",2h
@Danbrook03,21-17…Steelers upset,2h
@KarlMarXXX420,What if TJ and the Steelers D plays unconscious tonight and they pull a reverse Tebow?,2h
@TalkPittFootbal,"Juju has shown nothing but love to the Steelers and the city of Pittsburgh. Both with his words and actions. Now, after a ""season-ending"" injury, he'll be back for the biggest game of the year. Excited to watch him tonight and hopefully for years to come!",2h
@mahan_derek,#Prediction #NFL #NFLPlayoffs #SuperWildCardWeekend @Chiefs @steelers,2h
@937theFan,"Bet $10 on the Steelers Moneyline, Win $200 when the Steelers score a TD! Thanks to @BetMGM 1. Sign Up and Deposit $10 2. Bet $10 on the Steelers Moneyline 3. Win $200 when the Steelers score a TD Automatic $200 https://affiliate.betql.co/BetMGM_All_10WIN200Social…",2h
@KingEdward15,Lol someone who covers the Steelers can’t help themselves from talking about the Browns.,2h
@AudacySports,"Ben Roethlisberger’s career may never end. We had his final home game against the Browns. We had his final game, period, in Baltimore. Except that it wasn’t. #HereWeGo Tune into @937theFan for Steelers / Chiefs pre-game: https://auda.cy/KDKA",2h
@BtcNitrobetting,#NFL #WildCard Pittsburgh Steelers(+12..5) @ Kansas City Chiefs(-12.5) 8:15 PM ET O/U: 46 Chiefs are 4-0 ATS in their last 4 home games. Bet BTC https://bit.ly/3lq0NFL #Football #NFLTwitter #GamblingTwitter #SportsBetting,2h
@SteelCurtainRis,@SteelDad gives #SteelersNation his... https://steelcityblitz.com/scb-three-point-stance-your-steelers-chiefs-wild-card-guide/… #Steelers #Cheifs 3 Point Stance via @SCBlitz,2h
@handuffy7,Happy #RHOSLC #PorshasFamillyMatters #Euphoria and #Steelers game day to all those who celebrate.,2h
@alexbicek,"my nfl playoff prediction: get the Steelers to the Super Bowl, but don’t give Ben that ring for his last () game",2h
@Laker4life42,"Oh lmao, def the chiefs, steelers getting worked",2h
@MartyGolf35,@steelers She’s got the Terrible Towel charged up and ready to go! #HereWeGo,2h
@DIRTY757,Hope that the Steelers can keep Chris Collinsworthless quiet tonite.,2h
@KevinAges,"@SwainEvent @Mr_BigShot_Rob @TripleOGMixx @DRVawl @volstorm00 @BuckToTheNasty1 @TC_in_AthensGA Chiefs beating Steelers like a governor mule… @benmckee14 ,",2h
@dickridingg,steelers vs the world,2h
@ash_fisher1120,Is it 8:15 yet?! I’m ready to watch my @steelers play!!!! #Steelers #SteelersNation #HereWeGo,2h
@Magneko23,My #Ichigo chase has arrived and went straight to the hard stack lol. @OriginalFunko did a helluva a job on this one ! Also found this @Lj_era8 #FunkoGold on the shelf. No Chase left behind even if I am a #Steelers fan ! #Bleach #Manga,2h
@BigT54,“you queefs” I’m dying,2h
@TechTedTalk,"No Brees tonight, right ???? Yesterday was hard to watch",2h
@L3M4SK,lowkey want the steelers to win,2h
@akeat24,Ready for the @steelers to shock the system #HereWeGo LFG!,2h
@missywalt,I’m already mentally exhausted and we are still two hours from kickoff #Steelers,2h
@2MinsForHockey,"Here it is. I'm a data analyst. Data almost always wins. AFC: Titans (4), Chiefs (6), Bills (2), Bengals (4), Raiders (3), Patriots (2), Steelers (2) NFC: Packers (5), Bucs (4), Cowboys (3), Rams (2), Cardinals (5), 49ers (4), Eagles (0) Nothing egregious here for the Bills.",2h
@ironcitykid33,look for boswell to win it again as time expires! 23-21 Steelers survive and advance!,2h
@RandomCharStr,No. No it will not (and good riddance).,2h
@SObernauer,"I’m just sitting here minding my own business, fire in the fire place, watching football eating lasagna. Waiting for the climax of the evening around 815 when the Steelers will disappoint",2h
@BlackBo34014168,This maybe Big Ben last shot.,2h
@JiveNarduzzi,"Pittsburghers ramping up speculative anger about cable possibly going out during a Steelers game that’s not even on cable is Pure Yinzer. Like, go to Best Buy and get an HD antenna for $30 for backup. You will not only get the game on 11, you’ll get shit you never knew you had.",2h
@brinanner3,"I don’t really care much for any of the teams playing right now, but I hope the Steelers lose just because my coworker never stops talking about them",2h
@baller_royal,"Looks like he just got a text from Maholmes, ""Hey bro, we got a game today. Where you at?"" Then he rolls out of bed in his PJ'S and heads to Arrowhead in his robe! Don't think he's worried bout the Steelers.",2h
@itsa2foldthing,#ATX #HereWeGo #SteelerNation,2h
@caliser786,Good I hope you made it okay the rest of the way But think of this if the @steelers win you are gonna be so pumped walking back that way #HereWeGo,2h
@SteelersFanTN,"I’m a world where you can be anything, be a good human. #HereWeGo @steelers #LetsGo #WPMOYChallenge Heyward #ThankYouBen #SNUproud",2h
@iamgoofyLOL,Pittsburgh media wants Jimmy G on the Steelers? Lol,2h
@nvg737,"Just got off the horn with @LightsSteelGolf . It’s confirmed Steelers win. Put your mothers, fathers, sister, brothers, and neighbors cousins mortgage on this game. Go Ben go Steelers. We’re all we have we’re all we need.",2h
@cheytorucla,Niners-Steelers Super Bowl with both teams barely making the playoffs … how fitting,2h
@gerardomixcoatl,@steelers @NFLonFOX @FOXSportsMX,2h
@InterSteelers,Steelers 55-0 Chiefs,2h
@Laura_Lovecraft,Now hopefully the Cowboys and Steelers bite it today for the D-bag sweep,2h
@Richard71843396,Steelers fans other than me at church this morning,2h
@SourceNewton,Chiefs vs Steelers tonight baby Who you got,2h
@JWS1031,"Steelers Trump Card.... @_BigBen7 when asked about @dh_simba7 he said : ""Haskins has an arm like a Rocket "".... #SteelersNation #Steelers",2h
@B_rightBrooks,The @steelers pup,2h
@brncoslvr,Why did they put the Chiefs/Steelers game as the night one!? That will be a snooze fest,2h
@fontouradoug,"sinal da tv caiu bem perto do jogo do Steelers, aí é de ferrar o cara",2h
@mikaIbetta,We’re all rooting for the GOAT Big Ben and the Steelers today right? #NFLPlayoffs,2h
@SteveCarrollCA,Kansas City Chiefs vs. Pittsburgh Steelers: NFL Wild-Card Preview and Predictions http://dlvr.it/SHFHfq,2h
@MANOFSTEEL_79,What does This discussion have to do with WVU? Lol. You’re sensitive over the fact that you’re getting told facts. Mike Tomlin is a SB winning coach and has never had a losing season in 15 years. The Steelers were projected 4 wins this year. Triggered lol,2h
@hawk9000,Pittsburgh Steelers’ players strongly feel they could extend Ben Roethlisberger career at the team under one condition #SmartNews,2h
@Rachellepat,Dope!,2h
@Stickum371,and now Steelers. lol,2h
@Clutchington1,Steelers baby,2h
@CAPT_Eck,We survived. I know what wifey will be doing while I’m watching the #Steelers,2h
@KimberlyColumb5,"Put me in, Coach! GimME chance!",2h
@RevFranklinBigM,WHO DAT ? OOPS EXCUSE ME MY BAD GO STEELERS I HAD A SENIOR MOMENT,2h
@DillyOld,Chiefs 24 Steelers 17,2h
@kylegoettelmann,Man…I miss Swaggin Ike and some of those old Steelers defense! #HereWeGo,2h
@keersi_rochelle,Let's go @TeamJuJu #HereWeGo #ThankYouBen #NFLPlayoffs #Steelers #SteelersNation @steelers,2h
@InterSteelers,Steelers better,2h
@jdel818,And Steelers,2h
@kendad7553,Let's go Chiefs!,2h
@kacewells3,24-21 tonight. steelers,2h
@FCFBDragon,"Gunna be over 30degrees today in Sydney, tossing up which of my 2 favourite @NFL @steelers players jersey I’ll wear… @TeamJuJu or @_BigBen7 Maybe half game each. Let’s go #Steelers Upset of the decade coming! #NFLPlayoffs #NFL #HereWeGo #SteelerNation",2h
@imLtGriff,I meant w the Steelers game but same def,2h
@bobbywilson412,Pull out those frozen mozzarella sticks from the back of the freezer and stay home tonight for the Steelers game. Enjoy the game at home so DPW crews can do their job and so emergency services don't become overburdened with accidents that could have been prevented.,2h
@_kvngmike_,I like my Steelers tonight.. F*** the Chiefs.,2h
@jhathhorn,Just enjoy Steelers postseason Sunday night #Steelers #HereWeGo https://audacy.com/937thefan/sports/pittsburgh-steelers/just-enjoy-steelers-postseason-sunday-night?json?utm_campaign=sharebutton&utm_medium=social&utm_source=twitter.com&utm_term=KDKAFM… via @937thefan,2h
@DaleParish5,Great game for us neutrals.. if a steelers fan can be neutral when its comes to the cowboys,2h
@drewcookiii,The Steelers are playing with house money. They shouldn’t be in the playoffs. All that happens from here out is just gravy. Let’s go! #HereWeGo,2h
@the_legit_shag,Mason Rudolph is the next Steelers franchise QB.,2h
@e_soocrazy,I want the Steelers im thinking they gone win tonight,2h
@scottfraser75,Chiefs 41 Steelers 13,2h
@charly_g27,@ValMarinR @pepesegarra @EnriqueBurak @adevaldes Gracias a los 3 amigos y la mujer maravilla por está gran transmisión maratónica. Esperando con ansias el juego de Steelers.,2h
@DanFfl,Snow finally hit here in PA. Eagles looked awful for 55 minutes. Expecting the Steelers to lose by 20+,2h
@PipoGuRRu,Jajaja la de los Steelers es la más cabrona... Pero todo puede pasar...,2h
@Steelersdepot,Chase Claypool with the ice package per IG #Steelers,2h
@SharksWrld,Asking questions you know the answer to silly Gary!!Steelers!!,2h
@ItsJustGinoB,2 hours until the Steelers shock the football world. #HereWeGo,2h
@DanJMajkut,,2h
@Linc_Butler,"Win or lose, I'm going to enjoy every minute of Big Ben's last ride and savor every sip from this mug I've had since I was a kid. #HereWeGo @steelers",2h
@buckeyelogs,Happy to help!,2h
@15MinutesOnline,"The last time the #Steelers had the 20th pick in the NFL Draft (1985), they selected Daryl Sims, DE, University of Wisconsin. He played two seasons in Pittsburgh.",2h
@theweakdayz,Steelers,2h
@crystian916,"You can't give Ben all the credit when the Steelers win, but blame Tomlin when the Steelers lose. Your hall of fame QB threw four interceptions in his last playoff game. Is that on Tomlin or the Hall of Fame QB?",2h
@rod1895,"Melhor sim, mas não esperei jogo equilibrado. Assim como acho que vai ser chiefs x Steelers.",2h
@Larry83Lemon,Chiefs 27 Steelers 20,2h
@tilt_contrls,Didn’t know the stillers played at McDonald’s tonight?,2h
@937theFan,Just enjoy Steelers postseason Sunday night #Steelers #HereWeGo https://audacy.com/937thefan/sports/pittsburgh-steelers/just-enjoy-steelers-postseason-sunday-night?json?utm_campaign=sharebutton&utm_medium=social&utm_source=twitter.com&utm_term=KDKAFM… via @937thefan,2h
@ShortArmOtheLaw,"Oh, I think you’ll be wide-awake. Go Steelers",2h
@2020Georgee,We were glad Buffalo won yesterday Autumn!,2h
@BeachamScott,Tell ya one thing we have best fans and hottest female fans in all sports. Let's go Steelers,2h
@parasitehdfilm,Watch ‘49ers vs Cowboys’: 2022 live streams free Reddit: NFC NFL Super Wildcard playoffs 𝐍𝐅𝐋 𝐒𝐭𝐫𝐞𝐚𝐦𝐬 𝐋𝐢𝐧𝐤 @footballnfllive Cowboys vs. 49ers NFL playoffs live updates Calm before the storm. |#ChiefsKingdom : #PITvsKC 8:15pm ET chiefs vs steelers,2h
@dufflebagboy32,1/16 NFL WC Steelers +13 (-110),2h
@lucasjubina1,Lers #Steelers,2h
@BigSwole2021,Grab that yellow towel and bump this,2h
@LilyDesforets,,2h
@TradrNate,If the Steelers win tonight I heard that every growth stock is going 100% next week Just what I’ve been told (not financial advice),2h
@Simplecommenta1,Big Ben should just retire #steelers #nflsimplified,2h
@ClutchBengals,And beat the Steelers…,2h
@Piratefan1970,He didn't call for the Steelers winning so I'm still holding out hope. Earlier in the week he felt they would lose.,2h
@ChiefsUnion,“I hope the steelers win the super bowl”,2h
@bditt34,You don’t watch football if you think Wilson helps this this Steeler team to the SB. He’s an upgrade over Rudolph but I’m not giving up multiple 1st rnd picks for him. He has a better OL and WRs than Steelers & won 7 games. This ain’t fantasy fb bro. I think Aaron is great but 39,2h
@haiderwf,For this alone we should all pull for the Steelers.,2h
@bcaldwell_WTAE,"#SteelersNation travels, gates open they flock @astockeyWTAE @wtae #Pittsburgh #Steelers",2h
@therealmjwice,At least they match the tie dye sweatshirt…,2h
@dre_gentry,Steelers- 30 Chiefs- 27,2h
@masonj77,What are the dog and cat names? Franco & Terry? Lol. Go STEELERS,2h
@CastroTrapMoney,Chiefs… I got a ticket on both tho. Steelers ticket the one dats gon pay out,2h
@RiverStars1,Chiefs 29 PIT Steelers 20,2h
@VivaLaPatriots,Let's go Steelers. Shock the world,2h
@UpDowntownBG,"No classes Monday so let’s come out tonight and watch the Steelers vs the Chiefs at 8:15! @_king_velle and @rost_brooke will be serving Happy hour prices all night long! @PocaPoca84 will be drawing the queen of hearts, which is over a $1,000 payout at 8:30!",2h
@Blitz_Burgh,LETS GOOOOO! #Steelers #NFL,2h
@stylezmorales,"Damn I forgot the chiefs and Steelers play tonight too. Then it’s another tomorrow, whew",2h
@TuziSZN,Pittsburgh Steelers QB could make a better song,2h
@BudlongNomad,"Never Again Sunday, Let’s make some Coins!! NFL Steelers +13 PITT v KC o23.5 1H PITT v KC o46.5 Player Props / Anytime Touchdown Chase Claypool o3.5 Rec -165 Travis Kelce -120 Anytime TD Travis Kelce +600 1st TD of the game #GamblingTwiitter #Sportsbetting #Freepicks #NFLPicks",2h
@lynchsvision,It’s f*ck the Steelers all day every day.,2h
@SWpintsylvania,Steelers didn't play yet. @Levi_Fetterman /Artie is a Pittsburgher regardless of their love of Gritty in Philly.,2h
@Hoodlum71,My point is we are tired to no system. We don't have an identity and haven't for to long. Be Steelers are perfection example. They draft and develop players that are they identity they want to be. I hate them but respect hope they operate,2h
@thedopedoctor,We ready. #SteelersNation #HereWeGo #Steelers #Chiefs @_BigBen7,2h
@steelers_n6tion,"I turn 25 Tuesday January 18th. 2+5=7 (7th seed, Big Ben 7, Super Bowl #7). 18=Ben’s years of experience. You’re welcome. #HEREWEGO #STEELERS",2h
@mrburnerking,Steelers fatass fandom nation found me oh shit I don’t belong inside this circlejerk,2h
@reptheduke,Now Ravens or Steelers. Fuck that,2h
@JesusAg99778991,"#WildCardEnTUDN saludos @pepesegarra y @adevaldes , por supuesto a mí esposa #ViviSegovia quien es #Steelers desde Mexicali, fiel a #Chargers, esperando no sea el último juego de #BigBen 7",2h
@diegotimmers,Boatos que é a casa nova do lucio hein,2h
@diva_doyenne,My heart is with Big Ben and the Steelers but I think KC wins tonight.,2h
@OTLSportsCA,"Big Ben vs. Mahomes The Steelers just squeezed their way into the playoffs, making tonight’s match a great underdog story, or a disaster for Pittsburgh! Jelani Reid previews tonight’s match in KC! : Jelani Reid https://overthelinesports.ca/football/f/steelers-v-chiefs-preview… #NFL #wildcard #OTL",2h
@BigBenNotWashed,Just go to a Steelers game,2h
@Blitz_Burgh,Claypool with all the ice before the game! #Steelers #NFL,2h
@terps2themoon,I was about to blackout and I said “ST0P. THE STEELERS PLAY STILl”,2h
@757Showtime,I got this for the chiefs Steelers game.,2h
@talkinbrave,And we still haven’t watched Chiefs-Steelers,2h
@peppypatty64,"From this very, very happy and celebratory Bengals fan, LFG to the Chiefs!! Please beat the cheating, stinking, Steelers.",2h
@AlexNeville4,"Bro, the Bills got beat by the Steelers. Tom could beat them by himself.",2h
@LeonardoSilvaPH,"Se trazer o Garoppolo e acrescentar umas peças na OL, os Steelers vão pros Playoffs em 2023 mais uma vez.",2h
@tonyde2121,Do the right thing @steelers Only Steeler gear in New Jersey for this family @r_debenedetto #oliviaissmart. Daddy’s hometown #HereWeGo,2h
@Steelersdepot,"Own the Chiefs, Ben. #Steelers",2h
@Bushyboy03,Only the Playoffs,2h
@TerryJo65227460,Let's see if they can win this wild card first?,2h
@blackyellowbr,Essa imagem no jogo 49ers x Cowboys é real? 2 HORAS PARA O JOGO DO STEELERS NOS PLAYOFFS,2h
@koolbueller,Steelers have a chance tonight?,2h
@ariberson97,@BigJerichool222 do you think the Slime Monster should be at the Steelers game tonight?,2h
@joealexpitt,Minkah Fitzpatrick is the one Tonight will be the greatest game for you steelers #39,2h
@Ell_Trip,I don't know if I can watch the @steelers play today. My anxiety is already through the roof.,2h
@tartan23,Preserved in glass. Signed by the man himself. Upside down.,2h
@KNechepurenko,Chief 27 Steelers 21,2h
@EddietheGreat84,I need someone's grandma to make me a Steelers blanket. #HereWeGo,2h
@Justiceforalic3,"Marcie and I usually watch the Steelers together, just like she did with Alicia. It's time... @steelers @_BigBen7 @TeamJuJu",2h
@MadaARmando,Let’s go Steelers,2h
@DanielBowenUSA,I really wish the Steelers would’ve drafted this guy.,2h
@scottharb,"@steelers aren’t a very good football team, BUT they are playing their best football. #football #Steelers #NFL #HereWeGo #Chiefs",2h
@soyRECO,"if the Steelers win, im cashing out though",2h
@savg_coyote,Steelers winning haha sike chiefs by 60,2h
@MichaelFraudan,Steelers over chiefs,2h
@Jamesc1659,Uh erick ? I'm a steelers fan,2h
@neutron_figg,You can really see why Ben has to resort to rape. He’s hideous.,2h
@AlexSmith2775,"I think in the 6 team playoff era, wildcard weekend road teams won at like 45%. And now here we are, to get to that number or close, we’d need a Niners/Steelers/Cards sweep lol",2h
@gabrielrseilhe,Maravilhosaaaaaaaaaa Quero ver se vai colocar uns do STEELERS mais tarde,2h
@mmyzii_,I like the chiefs bitch ass Steelers fans,2h
@brandon_peeps,I’ve been waiting for a road team to win this weekend. Just prefer it not be the 49ers or Steelers. I’d be more than happy if the Cardinals win Monday.,2h
@timber_custom,It’s just a matter of execution. Steelers can win this if they play without the mental errors that have bitten them all year.,2h
@Eeeddd33444,24-17 steelers,2h
@vngwrld,I wanna see Mahomes abuse the Steelers tonight,2h
@DaveKinkdade,Good luck tonight vs the Steelers,2h
@DFusion89,I can understand. As a Broncos fan it would nice to see the Chiefs loose tonight but I don’t see that happening with the Steelers.,2h
@JorgeAn26799553,The only way the Dallas Cowboys s to win is by having Faith in zuerlien? The Dallas Cowboys kicker I think ..he has been blaspheme by a lot of Dallas Cowboys fans. Now Mr. Zuerlien show me the Faith you as a Kicker in the 4th quater.,2h
@UofKSteelersFan,,2h
@OfficialATL3,Big Ben Retirement Party,2h
@peppypatty64,"F the Steelers. Go Chiefs!! Love, a Bengals fan",2h
@ChiefsCrab,I am sure with Reid and their vets they know better but i hope the @Chiefs are not overlooking the Steelers. When a team has no expectations and nothing to lose it makes them very dangerous.,2h
@theandijuniarta,The sole purpose of this account is to jinx anything good going on in the NFL. You can't convince me otherwise.,2h
@meowgann13,"I just want to publicly apologize to my neighbors, if the Steelers win I will wear my Big Ben jersey and run down the street. Ain’t the first time we’ve been the underdog. It ain’t over yet for Big Ben & imma stand by that. #HereWeGo #SteelerNation",2h
@Bets4Breakfast,NFL bets open for the wild card weekend: I’m still contemplating adding an emergency teaser before the Steelers v Chiefs game tonight.,2h
@kevpghsportsfan,"Great point. Pressure is on KC. What is the worst that happens, Steelers get blown out like the Patriots or Eagles? Ben goes out in style",2h
@explicit_baby,Let’s Go dominate the 2nd half Cowboys,2h
@ay_taybay,"Melvin Ingram didn’t want to play for the Steelers anymore, when 1. He knew his role coming into Pittsburgh and 2. Accepted that and still wanted came We meet again with KC. And I just want Steelers to take care of business",2h
@dVinc13,Let's Go @steelers so ready!!!,2h
@prettyv28,Steelers,2h
@ibespinnyG,#GAMEDAY nothing to lose but let’s shock the world! @steelers @_hdot_ @M0IIS @B_weezy_9o @Bootsie_Adams @BrianaArmeni @ZachLamYMCMB1 #Steelers,2h
@YinzCards,As a Steelers fan I hope you’re wrong,2h
@Blitz_Burgh,What a looooonggggg day! Are we there yet? ALMOST! #Steelers #NFL,2h
@RickTea_E,Most Field Goals made without a miss in postseason career (Super Bowl era) 1. Robbie Gould: 18 (with 3 in 1st half today for @49ers ) 2. Chris Boswell: 16 (entering tonight's game for @steelers ) 3. Ryan Succop: 14 (with 1 today in the @Buccaneers win) Gould is a bucket,2h
@InterSteelers,Super Bowl bound #HereWeGo,2h
@colecpl,Be a Steelers fan for the day,2h
@sethfrnd,#BuffaloBills won yesterday which is great! But I know where I'm from. Go #Steelers!,2h
@Raider728,"""Acereros de Steelers"" en ti suena muy bien, hermosa!!!",2h
@BigDaddyKasyoka,#HeIsBack @TeamJuJu Have a great game ! Rooting for you and the @steelers #HereWeGo,2h
@GMaclagan,Do the Cards and Steelers have a rivalry that I'm not aware of?,2h
@ToddGyurke,Steelers by 10 tonight btw,2h
@FDSportsbook,AYOOOO @ThatsHockeyTalk LETS RIDE Who's locked in for the Steelers - Chiefs SGP? #FanDuelSameGameParlayHoliday,2h
