user,text,time
@AdamReid_,"Making this bet count Come on, @steelers",Now
@rainIoss,steelers with a chance to make it all better,1s
@gabrielgonz27,#HereWeGo #Steelers,2s
@TomBradyG0AT,If Steelers win tonight I’ll change my header to a picture of Usman,5s
@lyfe3433,Steelers Nation always knows how to travel!! #HereWeGo,6s
@SSwope_Sr,Steelers by a hundred,7s
@MKolodzaike,PITTSBURGH STEELERS FANS ARE TAKING OVER TWITTER HERE WE GO PITTSBURGH STEELERS HERE WE GO,8s
@Steeler46679129,Here we go Steelers Here we go!!,11s
@Michael09019841,,12s
@tatumplswin,unbelievable,13s
@lftovrpizzapod,Talk me out of Steelers +12.5,15s
@jxmorant12,BIG W,15s
@Pennvotes2020,Every #Steelers fan right now! #SteelersNation #benroethlisberger #SnowStorm2022 Let’s Go!!!,16s
@springfieldNL,The quest for Super Bowl LVI is on. Here’s how to watch the Chiefs-Steelers NFL playoff game Sunday.,19s
user,text,time
@chrisburgh,Don’t limit his snaps,23s
@Joycestacy13,,23s
@SpaceLauren,One hour till kickoff of the retirement party! #Steelers,24s
@averiemarino,steelers fans are the best fans in the world,27s
@whatnthehill,Steelers get a couple turnovers and I don’t know … +12.5 seems too high if you betting,28s
@Matt_MacKay_,Curious to see how much of a spark JuJu can provide for the Steelers in Big Ben’s final game tonight,29s
@averiemarino,steelers fans are the best fans in the world,33s
@whatnthehill,Steelers get a couple turnovers and I don’t know … +12.5 seems too high if you betting,33s
@Matt_MacKay_,Curious to see how much of a spark JuJu can provide for the Steelers in Big Ben’s final game tonight,34s
@Pennvotes2020,Every #Steelers fan right now! #SteelersNation #benroethlisberger #SnowStorm2022 Let’s Go!!!,30s
@springfieldNL,The quest for Super Bowl LVI is on. Here’s how to watch the Chiefs-Steelers NFL playoff game Sunday.,31s
@chrisburgh,Don’t limit his snaps,32s
@Joycestacy13,,32s
@SpaceLauren,One hour till kickoff of the retirement party! #Steelers,32s
@Rantingami2,"If watching the Bucs steal the Eagles wings today…watching the Cowboys fall off their horse by the Niners is just brilliant! Now waiting to see if Chiefs can 3peat or if Pittsburgh is gonna STEEL?? (I’m not a fan of the Steelers, so I’d like to see KC win.)",35s
@aNellytics,I’m sorry Kev. I just had to Tweet at me when the Steelers are down 30 at halftime for revenge,35s
@ArcticDB18,I’ve prepared myself for an entire week that the Steelers are gonna get blown out completely yet here I am getting absolutely nervous an hour before the game,36s
@OhElby,You must love Dak Prescott and hope he comes to the Steelers,38s
@MCM_67,I love my Steelers but how in the hell did this game end up on Sunday night? We should have at least had some public discourse regarding the ethics of televising executions.,38s
@CMtheLion1,"Pumped, excited… little bit nervous. Hoping for a good showing and pulling out the win. Lets go Steelers, beat dem Chiefs",41s
@SavnRyansPrvate,My Steelers will make easy work of these frauds,43s
@SpookyRaider,I really hope Al and Chris aren't calling the Steelers/Chiefs game,44s
@Damienmesta,,46s
@Joshbis10178243,Who u like in the Steelers Chiefs game skip closer than u think with Harris bama boy and minkah on defense,49s
@Bernabe12626597,HereWeGo Steelers! Whoop Whoop!,50s
@dcs914,Love the dedication and toughness he could of sat out considering he doesn’t have a contract for next year but he loves the game to much.,52s
@ay_taybay,I’m going to frame this. My heart,53s
@TheGridironLS,Pittsburgh Steelers inactives for their Wild Card match up vs Kansas City #ARTofPerfection,54s
@bossman_hendrix,I just need to Steelers to come on they for your boy now lol,58s
@fglentau,I #believe you got this #Steelers give'um heart & leave it all in God's hands. #HereWeGo #HereWeGo #HereWeGo,59s
@coachbowman67,Something the Steelers would do lol,1m
@UlisesMendez__,Ojalá mis steelers le ganen a Kansas,1m
@NFLCON,,1m
@Alex_Kozora,Steelers big underdogs tonight. Rightfully so. But last Sunday proved anything can happen. Keys to Pittsburgh pulling off one of the biggest upsets in playoff history. #Steelers,1m
@Damienmesta,,1m
@Joshbis10178243,Who u like in the Steelers Chiefs game skip closer than u think with Harris bama boy and minkah on defense,1m
@Bernabe12626597,HereWeGo Steelers! Whoop Whoop!,1m
@dcs914,Love the dedication and toughness he could of sat out considering he doesn’t have a contract for next year but he loves the game to much.,1m
@ay_taybay,I’m going to frame this. My heart,1m
@TheGridironLS,Pittsburgh Steelers inactives for their Wild Card match up vs Kansas City #ARTofPerfection,1m
@bossman_hendrix,I just need to Steelers to come on they for your boy now lol,1m
@fglentau,I #believe you got this #Steelers give'um heart & leave it all in God's hands. #HereWeGo #HereWeGo #HereWeGo,1m
@millerizer,Hoping for a great game #SteelersNation #Steelers,1m
@corygerman,I'm with you! I hate to say it but I may actually be pulling for the Steelers if forced,1m
@BandsomePapi__,If you wishing for the steelers to lose against the chiefs tonight that mean you racist. Mike Tomlin is the last black head coach in the league,1m
@MattRosenthal15,HES BAAAAAACK,1m
@letsgoBrendan,Let’s go boys. I more for Big Ben!!!!!,1m
@DickReed_,To be fair half of cinci are Steelers fans,1m
@EliasTM,"Te diría algo de tu Vaqueros, pero ahorita le toca a los Steelers.",1m
@TheDomsMom,28-24 Steelers,1m
@hydroflame,Let's go black and gold,1m
@_slavetothegame,27 for the Steelers?! That’s generous of you lol,1m
@_Boodie_,The Steelers going cover that spread,1m
@kimarshall15,There’s a fine line between confidence and self-delusion. That Steelers fan is going to be so mad when Rodgers goes to the Broncos.,1m
@CJ4Six,Let me chill because I already know what's about to happen to my Steelers.,1m
@BrKickoff,Logo na sequência dessa partida teremos o @10_Caio narrando Kansas city Chiefs x Pittsburgh Steelers com comentários de @opedropaulo_,1m
@InternetTre_,why does this feel like the steelers biggest playoff game ever? is it over hyped? or is it just because of the Ben situation?,1m
@DMSSportBetting,2 Free Picks NFL/NBA Cheifs/Steelers U47 (2 Units) Timberwolves 1H -1.5 (2.5 Units),1m
@IcyGamel,,1m
@WYTA_Podcast,WYTB Hosts Pick-Em: Nick - 28-24 Steelers Jack - 31-24 Steelers Christian - 21-17 Steelers Kevin - 31-24 Chiefs #NFL #Steelers,1m
@ArnieKnowsAll,Packers DVOA ranking. A true picture of a team's defense. Near the bottom of the playoff teams remaining. Only the bengals and Steelers are worse.,2m
@Me4everMore,Ready for the game! .#Steelers #BigBen #superfan,2m
@WYTA_Podcast,WYTB Hosts Pick-Em: Nick - 28-24 Steelers Jack - 31-24 Steelers Christian - 21-17 Steelers Kevin - 31-24 Chiefs #NFL #Steelers,2m
@IcyGamel,,2m
@MyPeepsShowPod,I really hope chiefs and steelers is a good game,2m
@3litees,Reply if steelers winning tonight,2m
@happyhelenb,Steelers are about to get eliminated next.,2m
@JoshuaClaytor,"I have deadass been watching the nfl network today expecting them to show the worst play off game, because let me tell you the chiefs and the steelers seem to be it, and I just now noticed that the game is from December and not the playoffs.",2m
@afc_d5j,FUCK I STILL DON’T BELIEVE HE’S BACK,2m
@Kronnus_,Se o Steelers passar hoje é o Big Ben que aposenta o Mahomes #NFLnaESPN,2m
@TargetsandTDs,Wild Card Weekend Games - AFC! Raiders/Bengals Patriots/Bills Steelers/Chiefs Click link to read about it: https://buff.ly/3fsVnf7 #FantasyFootball #TargetsandTDs #WildCardWeekend #RaidersNation #Bengals #Patriots #Bills #Steelers #Chiefs #BillsMafia #ChiefsKingdom,2m
@DownBadJuJu,SOOOO AROUSED LFG,2m
@WukTang,The Steelers should trade for Jimmy G If he also comes with George Kittle,2m
@deontatv,That’s Steelers chief game no longer interested,2m
@awkwardtastical,Steelers will play better than this and they have no shot I'm a Bills fan the rest of the way,2m
@SteelCurtainRis,Regardless of Result: http://bit.ly/3IqUIr9 The #Steelers were to play for the playoffs and not draft position. #Repost #HereWeGo,2m
@martin_aviles,JAJAJAJ By Martín Avilés,2m
@MacNCheeseJones,"True it just shocked me, since we cut buggs recebtly",2m
@eyeland2,I kind of want to see Steelers and Chefs but yeah Utah is a big game.,2m
@Kylab116,As a Steelers fan I could see this. Idk how much of a pitch count JuJu is on to make that much or an impact.,2m
@sabra22,Pray for my ears for the next game. Hubby’s a Steelers fan.,2m
@KenWo4LiFe,I gotta say Steelers chiefs is better than 9ers cowboys for my tastes.,2m
@xjoev_,Mixed feelings for tonight! LETS GO STEELERS! #SteelersNation,2m
@TacoCorpPod,On that beat,2m
@malekkarim2,Didn't nbc pay the same amount for steelers chief's lol,2m
@AZealousVoice,"I wanted to go to the Chiefs/Steelers game so bad, but the way my sleep & work schedule is set up",2m
@Dxnaruu,"JuJu’s return tho so it’s worth it, with the bonus of being the chiefs",2m
@ThankYouBigBen,,2m
@Steph__Driscoll,All of us last week: “This is the last time we’re going to see Big Ben play” *Steelers find their way into the playoffs* Big Ben: #HereWeGo,2m
@steelerslol,Horny,3m
@MKolodzaike,THIS MY 50TH YEAR AS A PITTSBURGH STEELERS FAN I CONSIDER MYSELF AS PITTSBURGH STEELERS NB. 1. FAN,3m
@MattDaleyOH,The Steelers are more likely to win today in a blowout than yo have Rodgers as their QB next season.,3m
@billy_DiIl96,Best,3m
@bellissimo_mmg,I’m going to be slamming a lot of doors at work tomorrow if the @steelers don’t bring home this W tonight #PSA #HereWeGo,3m
@JittPerked,dude said the steelers gonna beat the chiefs,3m
@ReedSlaton,Also by far the worst wildcard weekend I can remember. Now we get to watch the Steelers and chiefs on Sunday night football….,3m
@CapricornKCQB,What about the Steelers,3m
@Gecarti,Are yinz ready for some @steelers playoff football?! HERE. WE. GO. @ GEHA Field at Arrowhead Stadium,3m
@esasky17,Kansas city sucks,3m
@DeborahLBaker1,I do I do!!! ps .. Go Steelers! Good luck to Big Ben tonight!!!,3m
@mattstandiford,I enjoyed every minute of it. In a way it will sting less if my Steelers lose because I got to witness that glorious ness last night.,3m
@KelvinSantanaP1,Gogogo steelers,3m
@DemsJoke,Stick to soccer bro.,3m
@ToxicSteelerFan,TURN ME UP JUJU,3m
@WlTHERSPOON,W,3m
@liveontwolegs,Vamos a apalear a esos pinches Steelers. #ChiefsKingdom,3m
@tomiesteel,If The Steelers could just start their first possession without having the snap go over Ben’s head and into the end zone for a touchdown that would be a great start,3m
@nicnicny,20-17 steelers,3m
@bglinhart,LETS. GO.,3m
@fantasysportsso,"Darrel Williams active, Rashad Fenton and Josh Gordon inactive for Chiefs-Steelers",3m
@BoozeAndBall,Don’t play then. It’s no excuse they both are terrible since the Patriots game. We’re like the steelers playing weak teams and winning then when we actually play someone we lose.,3m
@BILLIONAIREBLH,Juju,3m
@ayyololo,Might have to go to a different bar for this Steelers game,3m
@Rembeagle,#HereWeGo @steelers,3m
@VictxrGutierrez,Ball out Kid #HereWeGo #FightOn,3m
@Concern_UMatter,Let’s go Steelers! Ben we love you! Thank you!,3m
@CJjeepdude,34-21 Chiefs. It’ll be closer than most think. We (Chiefs) always struggle against y’all (Steelers).,3m
@Stained_Plazma,I assume he's tiktoking at the 50?,3m
@rmd1064,That would be the Steelers.,3m
@sean98555,Im not emotionally prepared for a Juju-Ben TD,3m
@elbichopack,Super Bowl next,3m
@rmd1064,That would be the Steelers.,4m
@sean98555,Im not emotionally prepared for a Juju-Ben TD,4m
@elbichopack,Super Bowl next,4m
@ItalianChungus,Ben’s boy is back LETS GET IT,4m
@BrianButler0,So if both rosters are 53 players why do the chiefs have 7 inactive and steelers have only 5?,4m
@steelersfrance,Allez je vais lancer un Space avant le début du match:,4m
@ethagoat1,Now we just need Big Rape and the Steelers out of the playoffs,4m
@ryanmazon3,We automatically won,4m
@tylerconger11,You have a better chance of typing a tweet correctly then the Steelers have of winning.,4m
@DWC_78,"That sounds good, can I come when the Steelers lose tonight?",4m
@jamesharrisonst,I’ll follow almost any #Steelers fam. But if you are like I have 10k followers and I only followed 700 back because I’m cute. Your a fan but your not Fam.,4m
@wall2way,daddy,4m
@paula__k__,Steelers fans that are talking aren’t gonna be talking after tonight huh,4m
@jhong3680,And miss the chiefs beat down the Steelers? Not a chance!,4m
@dre_hefamous,My steelers game otw,4m
@ProFootballTalk,"Darrel Williams active, Rashad Fenton and Josh Gordon inactive for Chiefs-Steelers.",4m
@joshfann43,He didn't play last time we played the Steelers,4m
@juanitodemonio,A los steelers no los estés chingando,4m
@FelipeL88125182,,4m
@davidrosswelsh,JUJU GOT ME BRICKED UP,4m
@coolkidcodyy,Beautiful,4m
@wondietwin,JUJUUUUUU,4m
@Jay4x_,So nobody wannabet ? I got the Steelers,4m
@MalikDontCap,Lfg,4m
@fabiielainee,Crying,4m
@__jaytaughtyouu,steelers n chiefs bet sumn?,4m
@_bdaubs_,Steelers gonna win,4m
@610SportsKC,"Edwards-Helaire is out as expected, Darrel Williams is active for #Chiefs-#Steelers wild card matchup: http://bit.ly/3nvYlUx",4m
@1fatquan,I think da Steelers gone win,4m
@tigerdan151,It had better not be. Chiefs need to treat the Steelers like the #7 seed that they are.,4m
@TinkersCurses,"When I was kid, the Dallas Cowboys were THE team. And then ever since they beat my Steelers in SB 30, they’ve been nothing but overhyped, overrated, and honestly, irrelevant. … and I’m fine with that.",4m
@westonblasi,If you have no QB and your team is good like the Steelers it might make sense as crazy as it sounds,4m
@DennisMoy3,Good hopefully my sister's 49ners win... And next my Pittsburg Steelers win tonight as well,4m
@ALife_Xavi,Steelers beating the chiefs tonight,4m
@FATBOY_TRAVO,Social media bout to be fire tonight if cowboys and Steelers lose on same day,4m
@Sparty_VZ,"GO BILLS!, but as of right now let's support the little brothers of the Pittsburgh Maulers so the Bills can get a home game next week. LET'S GO STEELERS!!!!",4m
@rollinlarge,Why do the chiefs have 6 inactives and Steelers 5?,4m
@SeanThomas39,Depressed to know all that’s left today is @Chiefs and @steelers . Yes Pitt fans you should take this as an insult.,4m
@fernandafzt,Espero que la paliza que le están metiendo a los cowboys no se la metan a mis poderosisimos steelers o me voy a retirar de esta vida.,5m
@PolytheneMercy,"por las huevas, bro ojalá salga ya 3l vídeo de @stephenasmith muerto e la risa bro los Steelers en el primetime vs KC",5m
@sean98555,I’m howling man Mccarthy is hilarious,5m
@steelers,,5m
@LindaRi71530527,Let’s Go Steelers,5m
@FATBOY_TRAVO,Social media bout to be fire tonight if cowboys and Steelers lose on same day,5m
@Sparty_VZ,"GO BILLS!, but as of right now let's support the little brothers of the Pittsburgh Maulers so the Bills can get a home game next week. LET'S GO STEELERS!!!!",5m
@rollinlarge,Why do the chiefs have 6 inactives and Steelers 5?,5m
@SeanThomas39,Depressed to know all that’s left today is @Chiefs and @steelers . Yes Pitt fans you should take this as an insult.,5m
@ALife_Xavi,Steelers beating the chiefs tonight,5m
@esneet4113,#HereWeGo @steelers WELCOME BACK @TeamJuJu !!! I hope @_BigBen7 throws some deep balls your way!!! #SteelersNation PLAYOFF SUNDAY!!,5m
@dougiebaseball,And miss this great Steelers chiefs game?? Lol,5m
@Eryn_NotErin,OH MAMA I’M IN FEAR FOR MY LIFE FROM THE LONG ARM OF THE LAW HERE WE GO @steelers,5m
@TaySmokeDank,I have $10 to lose so I bet on the Steelers tonight,5m
@CertEMHooRay,That’s awesome!!,5m
@Code_Orange23,Chiefs 34 Steelers 20 Passing Yards 612,5m
@mattfreedpghpg,Steelers wide receiver JuJu Smith-Schuster warms up before taking on the Chiefs.,5m
@703Moose,I have entered the Arlington Steelers bar. Somebody talk me out of +12.5,5m
@ItsVicDi,Eso dije yo en el partido de steelers vs browns el año pasado y no funcionó :/,5m
@OLGproline,In tonight's primetime slot... the Steelers (+11.5) look to shock the Chiefs. Do Pittsburgh have a cover in them?,5m
@vaneguu,#MartinAviles,5m
@MagicMayson,"There has been tons of flags, the offense just looks like it can’t do anything though . Don’t worry my Steelers about to get smacked next",5m
@MikeBourque16,We getting closer to game time Here we go steelers ps4l north country,5m
@BoardMaine,1-2 today because the Cowboys suck ass. Adding: Steelers: +12.5 #chasing #GamblingTwiiter,5m
@DownBadJuJu,#BetteringMyself,5m
@iPennyCrypto,No I'm hating on you because you're a steelers fan.,5m
@LieutenantLock,Chiefs/Steelers O46.5 1.5 Units,5m
@ninjapig17,Wait till u watch the Steelers play,5m
@AuthorJMicc,#WritingCommunity #WritersCommunity #Writing #Writer #Writers #WritersLife #Writing #NFL #NFLTwitter #ChiefsKingdom #Steelers,5m
@steelfan88,Not if you were calling the plays,5m
@steelfan88,Not if you were calling the plays,6m
@HillarysTaint,BIG BEN TOOK A VIAGRA BEFORE HE RAPED THAT ONE CHICK!,6m
@JORGEWUINI,En este 2022 vas a ver tu aguanta cabeza!!!,6m
@KeithFridrich,"Browns lid ever going to happen, or is that a line too far? I know I will never wear Steelers gear, and I try to avoid anything close. That is why those first shirts at the GN were...problematic.",6m
@KelvinSantanaP1,Bamos por heyos bamos a jubilar halos chiefGo go go steelers,6m
@tepelepew,Take us Steelers fans outta that shit. Those are some delusional mothafuckas. Try Steelers and Raiders.,6m
@youngandwise83,Steelers offense struggled all year bro they ain't changing shit,6m
@BChizlett,Chiefs 47 Steelers 26,6m
@MatFauth,2023 is upon us and the Steelers haven't played yet,6m
@Cuuhraig,"I got Steelers for the upset tonight , if you feel otherwise lmk",6m
@pg13_akacarlos,REMEMBER THIS THE STEELERS ARE WINNING TONIGHT #HereWeGo,6m
@bobbyevans,@mollydollyy @KyleBrandt who do you got in tonight’s game between the Steelers and chiefs it will be a blowout for Kansas City 35-7,6m
@gogeta8431,#HereWeGo,6m
@Dread_Botlord,id be very fine with the steelers somehow winning a gnarly game in which big ben manages to finish with under 50 passing yards and 6 INTs,6m
@PatrickNFlorid1,#HereWeGo,6m
@RonFromLasVegas,#LAVEGAS TONIGHT THE Steelers and Kansas City Chiefs total points projected is 46: I think That's worth a $500.00 Wager it will go over that,6m
@ricardolope6633,Para mis amigos de #Steelers ahí les va un regalo,6m
@_MarleyDntShoot,Steelers gone win this bitch for Big Ben lol,6m
@urbs2332,Being a Broncos fan tonight I become a Temporary Steelers Fan! #HereWeGo,6m
@steelers_realm,Can’t wait to burn my couch and not get arrested after the Steelers shock the world #HereWeGo #Steelers #NFL,6m
@PandSsteelers,Price tags still on the towels. Welcome to Steelers nation lol. This is so cringe but I’m here for it,6m
@Watts_Zen,#cowboys so many yellow flags I'm starting to wonder if the Steelers game is actually on early #NFL #SFvsDAL,6m
@UtmTigg,Got the Steelers,6m
@wavewrim,WE GOT THIS BABY LET'S GO @steelers !!!! #HereWeGo,6m
@JuliusDjimon,Steelers losing by 28,6m
@Giss_Topezian,Por los Steelers,6m
@Stayalias_,I can’t wait to watch the Steelers lose by 50 tonight,6m
@MKolodzaike,PITTSBURGH PITTSBURGH PITTSBURGH PITTSBURGH PITTSBURGH PITTSBURGH PITTSBURGH STEELERS,6m
@Freddiesgato,This kid I’m watching the NFL Nickelodeon game with likes it so much that he’s already opened a Draft Kings account and has action on Steelers Chiefs. NFL prints money.,6m
@GloGodfrey,TBH with how random these wins are I’m going Steelers! It’s been a weekend of upsets so what’s next!,6m
@amaceingChris,Steelers till I die #HereWeGo #Yinzer,6m
@JFroggy7,@BarstoolBigCat we going under or over for Steelers/Chiefs? Need help,6m
@sarahinwv,#steelers @steelers,6m
@Thencinoman,Steelers suck lol,7m
@SteelersNetwork,Y’all are getting a great look at the Steelers starting QB next year in Jimmy G.,7m
@AwesemoNFL,"How to Bet Super Wild Card Pittsburgh Steelers vs. Kansas City Chiefs | NFL Best Bets, Picks & Predictions ~ @ottomatic13",7m
@Jdavis__,@steelers with the upset calling it now,7m
@SonnyDigital7,how u thinking first td steelers game homie,7m
@DiffordKim,Steelers need one win #TurnSNOWintoAnAcronym,7m
@T_Chartrand,"I get Bengals and Ravens trash talking but there’s also some sort of respect for the Steelers but the browns got nothing to say, little brother of the division gotta take a seat",7m
@amaceingChris,Steelers till I die #HereWeGo #Yinzer,7m
@JFroggy7,@BarstoolBigCat we going under or over for Steelers/Chiefs? Need help,7m
@sarahinwv,#steelers @steelers,7m
@hi_im_liana,I’m doing every voodoo magic manifestation spiritual bullshit I know how to do to make sure the Steelers lose tonight lol,7m
@GloGodfrey,TBH with how random these wins are I’m going Steelers! It’s been a weekend of upsets so what’s next!,7m
@_srr2_,#Steelers,7m
@marBdoll,BEST FANS EVER!!!!,7m
@HalliebethLane,Dallas and San Francisco is most definitely better than the Chiefs/Steelers game. I can see if Ben was still Ben lol.,7m
@shootdarockyt,I will be going live on twitch around 8 eastern watching the #NFL playoffs game between the #Steelers and the #Chiefs watch it here https://twitch.tv/shootdarock #HereWeGo #TwitchStreamers,7m
@Nobodyb21602706,"Yeah, that’s what I was referring to, my apologies for not making myself more clearer.",7m
Real Thing @9216,Fuck them Steelers. Never would I root for them,7m
@Rhinosteel6,Agree 100%,7m
@SimFre87,No way steelers win bro,7m
@OGdretti,Steelers got 6 remember dat,7m
@LuisAhmed,"Desde Monterrey, México.... vamos Steelers!!!",7m
@BrenDee85,I just can’t cheer for the Steelers…lol…,7m
@BetaTheta4,What a way to found out I lost... Enjoy the game Julie! #GoSteelers,7m
@AFLCymru,It’s painful,7m
@whoyoufooIin,Niggas acting Goodell chained them to the couch talm bout “We have to watch the Steelers next ”,7m
@MrTooChilt,Need the steelers to keep it close,7m
@EdwinThompson94,Wish I drove to KC to be around my fellow @steelers folks.,7m
@NyeClinton,"Definitely not ideal but they are healthier than the last Pitt game, as are the Steelers.",7m
@DANRBISHOP,"It is lovely, @stephenasmith , as he deserves, took some time to focus and prepare for 2022.. And the @dallascowboys did what he said they were going to do. If the @steelers get it done... well what will be beyond lovely",7m
@chriscanbe,Haha ! Sounds like you like Cowboys much like I like the Steelers.,7m
@DANRBISHOP,"It is lovely, @stephenasmith , as he deserves, took some time to focus and prepare for 2022.. And the @dallascowboys did what he said they were going to do. If the @steelers get it done... well what will be beyond lovely",8m
@chriscanbe,Haha ! Sounds like you like Cowboys much like I like the Steelers.,8m
@DjcurtC,"No! It's not enough, b/c if them fellas play a good game. U will eat all night.",8m
@DahnandDistance,Yeah dude wouldn’t anyone?,8m
@iz_litty,steelers with the upset,8m
@Peep_10,Steelers by a million now!,8m
@RAKlMJARRETT,Eh I wouldn’t bank on it. I don’t think Pickett is gonna be there but it’s not a guarantee the Steelers don’t trade up. They did at one point trade a lot to go get devin bush. If anything they sit still and get Sam Howell or Desmond Ridder () but I’ve been seeing both get buzz,8m
@mayapajevic,"I’m not a football fan but will be supporting the Steelers !! Also where did you get those N95 masks w/ the ear loops- been looking everywhere & haven’t found them. Also, thank you for doing all that you do YEG & the pts you see & the colleague you work with are lucky!",8m
@AFLCymru,Yeah I know,8m
@JohnnyBets007,Steelers plus points ML?,8m
@MaxwellVaughn,Steelers 27 Chiefs 23,8m
@RAuchampau,Gonna take a shot in the dark and say Pittsburgh Steelers,8m
@JayePow,I just did a lap of the field at arrowhead and fist bumped as many Steelers as I could see. I may work for KC but I’m a gracious host.,8m
@MKolodzaike,IM FROM TOLEDO OHIO SWEAR THIS MY 50TH YEAR AS PITTSBURGH STEELERS FAN HERE WE GO STEELERS HERE WE GO,8m
@JamesPalmerTV,Inactives STEELERS QB Dwayne Haskins WR Cody White RB Anthony McFarland LB Tegray Scales DT Carlos Davis CHIEFS WR Josh Gordon CB Rashad Fenton OL Prince Tega Wanogho RB Clyde Edwards-Helaire DE josh Kaindoh QB Shane Buechele RB Darwin Thompson,8m
@HillarysTaint,Plot twist for Big Ben tonight: someone is going to rape him!! #chiefs,8m
@PlayMaker_DUBB,I needa big game tonight Steelers,8m
@KeeganWest_,Say bye to Ben for us,8m
@petchalem,#WPMOYChallenge Heyward,8m
@ShareniiGuzman,Yeahhh go Steelers,8m
@tylerconger11,I wish I was with @NathanHester23 tonight to watch the Steelers get mauled.,8m
@anmagert33,Thanks bro,8m
@patriotsnews247,"People think tonight’s game between the #Steelers and the #Chiefs will be a blowout, but I don’t think that’s the case. It’ll be closer than people think and the Steelers could pull off the upset.",8m
@_bonanns,Chiefs 27 Steelers 35,8m
@L_BEAST21,HERE WE GO STEELERS...HERE WE GO!! HERE WE GO STEELERS...HERE WE GO!! HERE WE GO STEELERS...HERE WE GO!! HERE WE GO STEELERS...HERE WE GO!! HERE WE GO STEELERS...HERE WE GO!! HERE WE GO STEELERS...HERE WE GO!! #HereWeGo,8m
@tomiesteel,Steelers will most likely have to trade up to get Pickett,8m
@Colette57476616,@_TJWatt Heck I don’t believe This I want The STEELERS to win but I’m still for the CHIEFS because my best friends Late Father was a CHIEFS Fan All I want to say May The BEST TEAM WIN,8m
@oversizedoreos,I hope the chiefs beat the shit out of the Steelers,8m
@PeteSudbury,Go Steelers.I like the Chiefs and I like Mahomes and am not scared of them but I'd rather take my chances on the Bengals.,8m
