user,text,time
@quiquegaray,"Big Ben deja grandes recuerdos a los @steelers Me parece que siempre lo recordaremos por aquel increíble, maravilloso pase de TD a Santonio Holmes, para vencer a Arizona en el Super Bowl. #GraciasBigBen",21m
@jrsnowden25,What is a loose beard?,21m
@ticklemekellmo,"Takeaways from this game: TJ Watt is worth every penny, Mike Tomlin could take a high school team to the playoffs, people from Ohio are obsessed with the Steelers",21m
@Blitz_Burgh,2 minutes left for Big Ben. #Steelers #NFL,21m
@blakestonks,"Jazz +0.45 , Timberwolves +0.45 , 49ers +0.45 ( all were .5 Unit bets which would return .45 ) = 1.35 Units $20 would return $18 on a .5 Unit ( 90% or .45 ). 18x3 = $54. If you bet Steelers game you'd subtract .5 Units from 1.35 which would eaual .85 Units.",21m
@jlibhart,#PITvsKC @Steelers what is this shit dink and dunk offense you are doing? This has been our problem this year. The off play calls like this,21m
@HoudiniYou,I’m not mass anymore. Just enjoying my dawg Ben last few drives as a Pittsburgh Steelers. Farewell my brother.,21m
@SapphicWelding,i would put down 10 bucks on the steelers right now if i had an account with william hill or somethin,21m
@Jayde_B_Nelson,My Steelers,21m
@UrinatingTree,"Don't deny the cold reality: The Pittsburgh Steelers fucking sucked this year. Their offense was awful, they only survived thanks to refball, the other teams self-destructing, and splash plays. They didn't deserve to be in the playoffs and they showed why tonight.",21m
@bebojack,Steelers have some nice cap space but a lot of holes,21m
@marasco0815,ahhahahaahahha..you know who did not get a participation trophy you clown,21m
@OConnor7,hopefully never see Okorafor in a Steelers uniform again,21m
@frankiehero,"and just like that, a steelers loss",21m
@TrumpWon001,FIRE TOMLIN,21m
@twimmercom,steelers is nr.8 trending hashtag in NL in afgelopen 4 uur. https://twimmer.com/h/steelers #steelers,21m
@Fakemadrid7,Who knows Steelers are going to come back and win Big Ben is the best QB in the nfl I think they got this,21m
@TheRealReid11,"We’re waiting, Joe",21m
@PrivettEric,Yeah that’s what players who never bee on a play team tells themselves to make themselves feel better about sucking so bad.,21m
@rhv_71,"Si te vas por esas comparaciones los Steelers tienen un récord parecido, solito se cae todo tu argumento 62 temporadas, 32 veces en playoffs, 6 campeonatos. Si eso no los hace constantemente buenos, ¿que otro equipo si lo es?",21m
@GrammyUnit2005,"I think the #Steelers should fire Canada and see if #BigBen wants to be OC, if Flores doesn't get hired bring him in as DC.....Get some speed on this team they need Speed and depth",21m
@soyJaviGamboa,"El partido pintaba para otra cosa. Se notó en el primer cuarto y una parte del segundo. La defensiva de Steelers se sabe de lo que es capaz, venían “sin presión” por ser los UD, último partido de BB, se esperaba que a la ofensiva hubiera algo mejor.",21m
@Dinger_Singer,"But Tree, you said the Steelers are going to the Super Bowl. You never said what year",21m
@jodybeats,I’m singling him out bc he made the comment. Would you rather me say Browns teams with Joe Thomas on them were owned by the Steelers? That’s too wordy lol,21m
@pupp_edogg,@steelers sweep with snell and play action to a receiver to the end zone,21m
@shadow_30877,"Hey, you didn’t say the Steelers were going to the Super Bowl THIS year",21m
@OhHeyIts_Sami,Wild to think this is Roethlisberger's last game with the Steelers,22m
@Yomi_isHere,The universe will be corrected . A star is born everytime the steelers lose,22m
@_Itzel_Mon,"Tú, deja a mis Steelers",22m
@dilleemonc,At least next year you'll be allowed to like the Steelers without forcing yourself to be a rape apologist,22m
@pallaj157,"Thank you #7, We love you!! #steelers #HereWeGo",22m
@bricola21,"I wouldn’t be mad if Steelers got rid of Johnson. When he catches it, he always runs 3 yards backwards. Simply not getting the job done",22m
@Warrior_MuuMuu,Still going?,22m
@rfinnell_3,@steelers without matt Canada #nfl #fuckthecheifs,22m
@IvanOrnelas2,Steelers beat the Chiefs one time on the playoffs with a limited offense. Lightning doesn’t strike twice. #PITvsKC,22m
@Mtopper82,This probably being Ben's last game why didn't you just keep this to yourself????,22m
@MattAlbrecht10,If the Steelers find a good QB this off-season. I think they could be pretty good next year.,22m
@BIG_VICSF,"My family is made up of raider fans, cowboy fans, and Steelers fans. I’m the only niner fan. I may schedule an immediate family reunion. I’m thinking 49er themed Deebo jerseys for everybody.",22m
@Centerstrain01,It's called a Team Game...Tell me you don't know Football without telling me you don't know Football SMH,22m
@JackalJackass,Nothing but respect for the @steelers from #ChiefsKingdom @Chiefs,22m
@_BigDawg87,"No he shouldn't be. 15 consecutive winning seasons, two Super Bowls appearances with 1 win. Tomlinson is a great coach. There's a reason why the Steelers have only had 3 head coaches in franchise history.",22m
@QuanGottaStack_,Chiefs beat df outta Steelers,22m
@butch95472079,I couldn’t imagine my team having a record like this to a divisional “rival”. At least I have something to hold on to. You literally have absolutely nothing,22m
@CoryKinsinger,"If the Steelers hit the draft this year they can still be a competitive team. They have good skill position players, and a solid core on defense. Unfortunately that’s a huge if. Would have to be a draft for the ages",22m
@chrisloganOU812,Love my @steelers ! It was a major victory just to get here tonight. I'll be pulling for them next year! Thanks for the thrills #7!,22m
@ChrisRyMac,Steelers getting wrecked in Big Ben’s last game,22m
@MarkSadowy,We talk shit as much as you yinzers cry,22m
@Truffle_Duffle,I’m literally a whole steelers fan but yeah this shit is fucking embarrassing,22m
@twalman79,You really took the all or nothing to heart with that 0-16 season,22m
@GottidevonR,@Ckbirds can we get a simulation on this year simulated but with prime Big Ben on the Steelers,22m
@MrPittsburghFan,great careeer but you wore a Clown uniform your whole career,22m
@lilbigDgrande,Evil won today,22m
@HayekandHockey,"I can think that the Steelers should've won more with Ben, but also recognize that a dynasty that the NFL has never seen before blocked them a lot of the time. It sucks to be on that side. But then there's the Penguins always blocking the Caps",22m
@Shauncore,I know it's garbage time but we cannot let the Steelers put up 28 points...,22m
@FerAlvarez,Días muy duros para la Nación Cowboys y Steelers este domingo. Dos de las franquicias de la @NFL con más aficionados en el planeta. #NFL,22m
@jaxelburgh,"Honestly, this Steelers team is terrible. It’s wild they made it this far, & they only did so by sheer force of will from Tomlin & leaders like Cam, T.J. & Najee. Not a bad season tbh! And who knows what this team will look like next year, so, here’s to this bunch of misfits!",23m
@David_Coffey1,Steelers are so bad,23m
@leonviejoMorgan,,23m
@f4pbpz88sq,Your career is defined as a loser..,23m
@MrBazingaMan3,"True, but have you considered that the Steelers are going to the super bowl?",23m
@ChrisRyMac,Steelers getting wrecked in Big Ben’s last game,23m
@Truffle_Duffle,I’m literally a whole steelers fan but yeah this shit is fucking embarrassing,23m
@twalman79,You really took the all or nothing to heart with that 0-16 season,23m
@GottidevonR,@Ckbirds can we get a simulation on this year simulated but with prime Big Ben on the Steelers,23m
@MrPittsburghFan,great careeer but you wore a Clown uniform your whole career,23m
@lilbigDgrande,Evil won today,23m
@HayekandHockey,"I can think that the Steelers should've won more with Ben, but also recognize that a dynasty that the NFL has never seen before blocked them a lot of the time. It sucks to be on that side. But then there's the Penguins always blocking the Caps",23m
@Shauncore,I know it's garbage time but we cannot let the Steelers put up 28 points...,23m
@FerAlvarez,Días muy duros para la Nación Cowboys y Steelers este domingo. Dos de las franquicias de la @NFL con más aficionados en el planeta. #NFL,23m
@ZachCohenFB,That’s what I figured. Now you just need a good OT (or two) and that OLine should be set haha,23m
@Cooper_DFF,Do people that are not Steelers fans think fondly of Ben Roethlisberger,23m
@hollywobbbbbly,"You are a legend sir, but your faith was misplaced",23m
@Alex_Kozora,"Patrick Mahomes in three career games against the Steelers. 76/97 (78.4%) 988 yards, 14 TDs, 1 INT. #Steelers",23m
@arrosen76,YOOOO,23m
@JoeRogansalt,Steelers game is not over yet,23m
@shaddup_mcgee,I’m glad the Chiefs are beating the breaks off of the Steelers. I’m also happy that Big Ben is also gonna retire at the end of this season.,23m
@itYasminHi,Just thinking about when Ben is going to make his retirement announcement he played his heart out with no O line helping him #steelers,23m
@Surfsidekid1,Lol so long ago. What have they done lately nothing,23m
@Frenchi55,Excuses are for losers.,23m
@appis_this,I mean if the accusations r true u gotta feel bad for the support of this guy,23m
@HotBiscuitCam,"Nothing else to say. Thank yew 7. Thank yew for 18 years of excellence of my 23 years on this Earth. Yew will ALWAYS be a legend in the arahnd Steelers Nation, Pittsburgh, and arahnd the NFL @_BigBen7 #HereWeGo",23m
@HoodieHiltonn,Reply boy,23m
@Coachamd,The @steelers have just as many offensive weapons as any opponent…the difference has been play calling and the offensive line. Let’s fix this!!!,23m
@Dan49076443,I think the beagles would have dominated the Steelers #PITvsKC,23m
@Guentzel59,Defense??,23m
@CARLOSEES,"Steelers está peleando como los grandes, solo que es más grande Kansas. Tampoco se va tan culero #BigBen !!! Están dando batalla. El reloj no les va a alcanzar",23m
@TuxedoTn,Ok so hear me out: Marcus Mariota as Steelers QB next year. #PITvsKC,23m
@richsolir,"Entre tus Pats y los Steelers, parece que estoy viendo jugar a mis Jets.",23m
@mamba__b,"Only bae and my besties can reach me right now…. Regards, angry Steelers fan.",23m
@Steelersdepot,Two-Minute Warning #Steelers,23m
@SnowbunniChaser,"white people are scared shitless of winstons arm, still on track to finish top 5 in career passing tds and yards",23m
@StrongBad328,Same goes for the Steelers,23m
@MontseOrtiz8,Ni el de los Steelers,23m
@avi_cd,Steelers offense doing some of the most blatant statpadding I've seen,23m
@TweetsByFelix,Heres hoping Tomlin takes out all the Steelers so this game can be over.,23m
@smalls96,If Ben can get me this middle/cover on Steelers +13.5 I will say exactly 1 nice thing about him.,23m
@_TheNightHwk,Well let's enjoy the last minutes of Big Ben #Steelers #HereWeGo,23m
@jkarlosgarrido,Steelers de toda la vida,23m
@Robplaysmooth,Steelers,23m
@stephens_jake,I appreciate that the Steelers are staying in bounds when I have them +21.5. Keep that clock moving,23m
@ManDime_Whitie,"Another year, another ass kicking in the first round for the Steelers. No better way then to send Ben off",23m
@DanielMOrnelas,"┻┳| ┳┻| ┻┳| ┳┻| ┻┳| ┳┻| ┻┳| ┳┻| ┻┳| ┳┻| ┻┳| ┳┻| ┻┳| •.•) Browns, Bengals & Ravens ┳┻|⊂ﾉ have won playoff games ┻┳| more recently than the ┳┻ Steelers.",23m
@NikkiRaeM,DJ signature 3 yard backwards turn #steelers,24m
@nhlpens,"Okay so Steelers fans, I'm still a newer fan so when it comes to offseason/management stuff I know nothing at all. What do the Steelers do in the offseason? Ben gone, rebuild coming? Or can they still be competitive next year?",24m
@iHackedyoTL,Sheeesh Steelers.,24m
@JeremyMiller25,They actually don't. The records stayed in Cleveland. Cool story though.,24m
@MMAcatfish,"I’m a Steelers fan. I’m watching the game. I’m wearing a Big Ben jersey. And her article is right. It is heavy and still just business with the nfl and well, fuck. Because he has been great (overall) since then. But it’s still a thing that happened at the same time.",24m
@MEGABUCBUC,Big Ben is now the 3rd highest post season passing leader. He will be 4th highest next week when Rodgers gets ahead but that doesn’t take away anything from the achievement #Steelers,24m
@CesarOrona,"Ahora si, GRACIAS @_BigBen7 @steelers @acereros @NFL @nflmx #HereWeGo",24m
@Robplaysmooth,Steelers,24m
@stephens_jake,I appreciate that the Steelers are staying in bounds when I have them +21.5. Keep that clock moving,24m
@ManDime_Whitie,"Another year, another ass kicking in the first round for the Steelers. No better way then to send Ben off",24m
@DanielMOrnelas,"┻┳| ┳┻| ┻┳| ┳┻| ┻┳| ┳┻| ┻┳| ┳┻| ┻┳| ┳┻| ┻┳| ┳┻| ┻┳| •.•) Browns, Bengals & Ravens ┳┻|⊂ﾉ have won playoff games ┻┳| more recently than the ┳┻ Steelers.",24m
@jkarlosgarrido,Steelers de toda la vida,24m
@Rxmpage_US,Steelers played good in the 1st quarter…,24m
@SammyFranklinss,Steelers really dropped like 40 on us man,24m
@lKritical,Steelers getting clapped lol,24m
@GaryGongaware,Raiders didn't tie last week,24m
@mairkrh,Mentally preparing myself for the #steelers Bubby Brister era reboot,24m
@BoulderBrowns,You won’t have to. Just hang out watching the Steelers in the AFCN for next 5 years.,24m
@SpartaMykonos,"The Steelers, who aren’t very good to begin with, looked like a high school team tonight, and Wright acts like they just won the Super Bowl. Very sad to watch Big Ben tonight, and most of the season. HOF career, though.",24m
@Haroldm22618925,"His last 4 playoff game loses including Tonite we've missed a QB in a Steelers uniform playing like a certified hofer .Nothing new having to wait ten years before another arrives ,he's prepared us for it .",24m
@Kristahave3,Steelers may have to spend the night in KC!,24m
@MrBlankName_,Really? How many playoff games did you play in? Ben's your daddy.,24m
@AceroAmericano,"Es que creo que si le apuestan a la ofensiva en los primeros picks, creo que van a dejar morir a su mejor unidad. El tiempo y la agencia libre los alcanzarán rápido. Y a como se han manejado, si seleccionan a un QB en primera ronda, dudo que vaya a ver acción. En fin, veremos.",24m
@MO_The_General,"When the Steelers had AB, Bell, and Ben you would've thought they would've won a couple",24m
@Mexicuautl,Creo que no eres muy bueno en tus predicciones. DEcías quen ibas a ganar la elecciones en Huixquilucan.,24m
@dieguicatalan,Que pitiza le estan metiendo a los steelers.,24m
@jasonbigmachine,@UrinatingTree that fumble on first down by Big Ben & the 9 yards after just sums up the Steelers season this year,24m
@Twitershitter96,The #Steelers best run of the night came on a fumbled snap. #Terrible,24m
@akeem7ven,Don’t feel bad Steelers… at the end of the game just say to the Chiefs.. I bet you won’t do that to Buffalo!!,24m
@Shenaniguy,Just one more TD. That’s all we want. #ThankYouBen #HereWeGo #Steelers,24m
@jason85765761,is he walking home yet?,24m
@jmrotter,"Duele, pero @Chiefs es mejor y se necesitaba mucho más para vencerlos. Gracias @_BigBen7 por tanto en 18 años, tres SB y dos trofeos, puras temporadas ganadoras #respect próximo #HallOfFame. Con @steelers en las buenas y en las malas.",24m
@Joasmheesa,"well, this loss really hurts the Steelers chance of going to the superbowl...",24m
@KelleyPc12,Ironic you even tweet this,24m
@PhDPalma,"So you were saying, @CoachTomlin is a Loser his post season record is one of the worst, @BruceArians is the reason we have Super Bowl rings and @CoachTomlin fired him the joke is on the @steelers we will never win again until he is gone mark my words",24m
@JosephMoney73,"Used to think you were a stand up guy despite playing for one of our rivals, but I was wrong. You’re just a ex-player that stood out for a historically awful organization. Enjoy being a dbag",24m
@SteelersOurWay,Dude you played in the league and you are chirping like one of those guys that live in their parents basement! The @steelers beat your team twice this season,24m
@dvldog0352,"Big Ben is a first ballot HOF QB. What a career. 3rd all time on passing yards in playoffs behind only Peyton Manning and Tom Brady. Thanks for the battles Big Ben, enjoy retirement. Going to be weird not seeing #7 on Sundays. #SteelersNation #Steelers #NFL #NFLPlayoffs #BigBen",25m
@MaddyMewMew,"yeah but their regular season was good, the Steelers got in because they won like 5-6 games they didn't deserve to win",25m
@BrioniBoy12,By giving up 40 in the WC again??? #steelers,25m
@EdCleary1,Thank You Ben. Good Night. @steelers #HereWeGo,25m
@AliSkiiirt,Realistically I think the Steelers sign Derek car if he doesn’t negotiate a contract with raiders or jimmy g in the off season,25m
@Jeessee15,Horrendous football tonight #Steelers,25m
@CJ_C9H7N,さあ、BigBen最後のドライブか、 #NFLPlayoffs #Steelers #Chiefs #SNF,25m
@_honeyrevenge_,"@_BigBen7 in my lifetime of watching Steelers football, you have been the only quarterback I’ve ever known. It’s going to be weird next year without seeing number 7 commanding the field! Enjoy retirement",25m
@kristabuck10,I have to go for the Bucs ( my sister is a die hard fan as I am to the Steelers). It’s been a privilege to have Ben lead our team. #7 Hall of Fame,25m
@NSamonas,"Joe Thomas only offensive lineman EVER to get voted to 10 consecutive pro bowls , how many Nate Washington got ? Lol",25m
@NehlsStan,Ok I’ve never said this is a good team,25m
@its_alyceea,Wait I honestly had no idea omg!! (Not a Steelers fan either) how awful!!!,25m
@nitchwayne,Now she say the Steelers are being crushed,25m
@bgreat1005,We knew the Steelers was butt lol I dont wanna hear non Cowboys,25m
@ksu89wildcat,I'm a Chiefs fan and agree with that. I wish Washington was on the Chiefs. He'd be our #2 receiver easily. Kid can run routes & catch.,25m
@KCChiefs_UK,2 minute warning. Chiefs 42 Steelers 21,25m
@TrumpWon001,FIRE TOMLIN,25m
@TrevorCHuante,The Chiefs: 3rd & 20 from the Steelers 48yd line Mahomes: house call dime to TE1 Result: KC TD,25m
@Teige15,If you only knew how laughable and pathetic this pic looks of a “grown” adult. LOL,25m
@trevbetter,Kansas City beat the Steelers using the Triangle offense #Kobe,25m
@stop_go1013,Mahomes is 3-0 against the Steelers. We pretty much never beat them my whole life before him,25m
@slammer33963191,Keep holding on to that playoff win drought. Hold it down big boy,25m
@gt_sundown,"…chargers would’ve been in Buffalo, it was raiders or Steelers going to KC",25m
@WhatsYourMoveBG,Took the #Steelers +28 in the 4th quarter for a dollar. This is getting exciting!,25m
@fkciii,"I am disappointed that you would take the time to engage in comments like this. I am a Steeler fan, and respected your career. Disappointing.",25m
@PlanetParker,It was a nice dream…,25m
@crewser128,The Steelers have had a head coaching dynasty Chuck Noll -> Bill Cowher -> Mike Tomlin 1969-?,25m
@davionzZz,I'm amazed the Steelers won 9 games with a QB who literally cannot accurately throw more than 10 feet,25m
@sjmontgomery_,They've won three playoff games in the last decade and missed the playoffs four times. But everyone keeps telling me Tomlin has never had a losing season. Is that the standard now for the Pittsburgh Steelers? No losing seasons? How far we've come.,25m
@FlyByKnite,"Steelers fan. I do like the Chargers, though. Would have much rather preferred to watch them than this team on my screen.",25m
@kamil__24,Steelers put Najee Harris back on the field! My parlay needs him to score a touchdown!!!,25m
@BrandonKBills,DMD,25m
@MaimanAndrew,"KC just has too much high octane in the tank and Steelers needed to be much more aggressive on offense, instead of playing all that small ball they played. From the number one Go Bills fan, hoping we can clobber those Chiefs next week!’n",26m
@gt_sundown,"…chargers would’ve been in Buffalo, it was raiders or Steelers going to KC",26m
@WhatsYourMoveBG,Took the #Steelers +28 in the 4th quarter for a dollar. This is getting exciting!,26m
@fkciii,"I am disappointed that you would take the time to engage in comments like this. I am a Steeler fan, and respected your career. Disappointing.",26m
@PlanetParker,It was a nice dream…,26m
@crewser128,The Steelers have had a head coaching dynasty Chuck Noll -> Bill Cowher -> Mike Tomlin 1969-?,26m
@davionzZz,I'm amazed the Steelers won 9 games with a QB who literally cannot accurately throw more than 10 feet,26m
@sjmontgomery_,They've won three playoff games in the last decade and missed the playoffs four times. But everyone keeps telling me Tomlin has never had a losing season. Is that the standard now for the Pittsburgh Steelers? No losing seasons? How far we've come.,26m
@FlyByKnite,"Steelers fan. I do like the Chargers, though. Would have much rather preferred to watch them than this team on my screen.",26m
@kamil__24,Steelers put Najee Harris back on the field! My parlay needs him to score a touchdown!!!,26m
@BrandonKBills,DMD,26m
@brainshitted,Here we go steelers!,26m
@MarkAGunnels,Who will be the Steelers quarterback next year?,26m
@tiggey5444,Steelers meet fork!!!!,26m
@EliasButcher3,Remember when Steelers fans said it was “sarcasm”.. that was a good one.,26m
@AlbinoBoogeyman,The fact you sir are a Stillers fan....you rock!,26m
@CoachAndreEllis,"SO, next Steelers franchise quarterback??",26m
@BrentMo28412566,Must suck to have to root for other teams to take out your rival since your team can’t do it. Yeah you win a playoff game last year congrats. 3 wins against a rival QB in 18 seasons. 3,26m
@IAmClassyK1ng,How’s Steelers doing,26m
@dlolley_pgh,And we're at the two-minute warning. It's 42-21 Chiefs over the Steelers. Steelers face second-and-3 at the KC 48.,26m
@Livi_tho,Dammm Steelers really going out like that smh,26m
@drewsblues2001,"Mike Tomlin should be embarrassed.. massively outcoached tonight, massively outcoached... in the last two playoff games the Pittsburgh Steelers have played they have given up 90 total points.. this is not a superbowl winning formula by any means...",26m
@JenJenMichelle,Steelers you brought pain to my eldest child and for that you must pay,26m
@gitt88,"Ben is legit literally just telling people what to do right now. There is no play call. It’s just Ben telling them “you run this, you run that” Ever since he started to do that the offense has showed life — amazing. Can he come back as the OC next year? #Steelers",26m
@MoparPenguins,Ya will. You’ll just be pissed Mason is the QB.,26m
@samisunflowerr,I already know the Steelers gonna lose,26m
@RTizador,Ya mero los alcanzan,26m
@BadGuyUte,"As a Bengals fan I always hated the Steelers, but there's been plenty of players for them I loved/envied. He was an awesome QB until his true colors showed. Now I can't stand the constant love for him for no reason.",26m
@jrsnowden25,Your jokes are worse than your hairline.,26m
@JadenSEAA,Hello pube boy,26m
@BRotoFFJason,FanDuel has the odds up for the Chiefs next week when their game is still going on today. Straight disrespect to the Steelers lmfaoooo,26m
@SteelerSanc16,Still throwing 5 yard passes down 21 is about as infuriating as it gets #Steelers,26m
@AgentNumbing,meanwhile Steelers getting absolutely housed by Chiefs,26m
@colin_dunlap,The Steelers 100 percent need to try to work out at least another one-year deal with JuJu.,26m
@theWilyVeteran,Better hope Steelers don't score here,26m
@urmomsonmydick,steelers bouta lose and lakers are gonna lose tomorrow why cant i have anything nice,26m
@UrinatingTree,"Thank fucking God, I don't have to pretend that the shitty Steelers are going to the Super Bowl anymore.",26m
@AldensThoughts,"I don't always root for the Steelers, but I loved watching Big Ben play football.",26m
@HeffnerNot,Let Canada and butler walk wasting talent for four years defintly got the mediocre part down,26m
@augiechapas,"Gotta give the Steelers credit, they’re playing a lot better than I expected",26m
@oloesteves,We will lose but #Steelers have the realest fan. No fake ass sore loser fans #HereWeGo #SteelersNation forever baby,26m
@lifeofswoosh,you played on that sorry ass browns team for 10+ years and never once made the playoffs stop talking about things you know nothing about,26m
@Ms_JLuca,I can't help but keep my Steelers pride. Been a fan way too long not to.,26m
@KylePatrie,Heck of a career Roethlisberger! Those Pats-Steelers games were some of the best! #BigBen | #HereWeGo,26m
@G40656482,Come on man!!! Trash!!! time,26m
@MmaCrushU,How can you be good if you don’t win! Talented loser….,26m
@_ColdCutCombo,Anybody else still up sweating a Steelers teaser?,26m
@DenverDudeBets,Steelers come a TD or kick a FG PLS,26m
@VernonB11424446,From Jaguars debacle to Chiefs debacle the Steelers have not improved one bit is a totally fair assessment. Last five or so years a complete waste of time and effort. #PITvsKC,27m
@Johnnycatz15,Steelers couldn’t even keep it close enough to hold off the tv schedule announcements,27m
@AldensThoughts,"I don't always root for the Steelers, but I loved watching Big Ben play football.",27m
@HeffnerNot,Let Canada and butler walk wasting talent for four years defintly got the mediocre part down,27m
@augiechapas,"Gotta give the Steelers credit, they’re playing a lot better than I expected",27m
@oloesteves,We will lose but #Steelers have the realest fan. No fake ass sore loser fans #HereWeGo #SteelersNation forever baby,27m
@lifeofswoosh,you played on that sorry ass browns team for 10+ years and never once made the playoffs stop talking about things you know nothing about,27m
